,Text ,Code
995,"Please add your comments by February 12th, and we will be able to prepare the survey in time for launch at WordCamp Asia, February 21st.",3
996,"@themiked asking in an open ended form like that won't get the answer we want, but it is answerable. If a user is trying to do something, are they getting the answer from WP or elsewhere? (edited)",3
997,"Who can answer whether we have access to CrowdSignal? If not, iss Google forms an option?",3
998,why CrowdSignal? was it decided on previous meetings?,3
999,"CrowdSignal is former Pollbuddy... no decision, but it's the one that might stick around and is not on rented land...",3
1000,as it's owned by Automattic.,3
1001,"oki doki, I think we'll have more info from @Kenshino (Jon)",3
1002,"Does someone want to review whether CrowdSignal is appropriate?
ATM I have pretty low requirements. True false, 5 point likert scale + open ended questions",3
1003,I can create account and test it,3
1004,"yes, it's problematic because HelpHub is child theme for bbPress, plus we want to have SVN and GIT in the same repo",3
1005,"@valentinbora regarding the automation of the redirect process, we have discussed it before and there is an understanding that we didnt want to make it in batch, because we wanted to have our eyes on it. Not sure if it will change one day",3
1006,yes I am very well aware that it’s all handmade work,3
1007,but if there are any opportunities to automate small parts of it count me in,3
1008,I think @atachibana had a little tool to convert Wiki style formatting to the new style too,3
1009,https://unofficialtokyo.com/codex-converter/,3
1010,random stumble upon,3
1011,We should also maybe put out a bit of a celebratory post when we get over 50%,3
1012,Afterall this migration has been going on for like... 5 years,3
1013,(It was stuck until you took it over),3
1014,Okay so the thing is about that and I'm so sorry for holding on to the info for so long,3
1015,"@chanthaboune would like us to actually verify that we had higher engagement when the main WordPress twitter account pushed things out than now where it doesn't.
The assumption that having a Twitter account is just going to magically increase engagement isn't necessarily true, and it may create a discussion channel (on Twitter) that doesn't migrate back to Slack or P2",3
1016,I don't even know if main WordPress account publish things that are specific to what's currently happening in docs team,3
1017,(I didn't even know we have a Twitter account for docs),3
1018,"never mind, we can publish p2 post about what we want to do at WC Asia and then share it everywhere",3
1019,We don't have a Twitter account for Docs,3
1020,The general direction is that the main WordPress account used to publish important news across teams. Now it doesn't.,3
1021,That's what I meant,3
1022,Engagement didn't seem to suffer,3
1023,^ That's the general opinion at the top,3
1024,I don't think it was as detailed as team members would be,3
1025,personally I see a lot of potential but that's probably another discussion for another time,3
1026,one question about those,3
1027,"if someone is translating HelpHub, which badge do they get?",3
1028,polyglots is automatic from glotpress,3
1029,so people will not get one for translating HH,3
1030,"Docs Team. Cause it's not just translation, they're gonna have to learn how to write good docs in their language",3
1031,oki doki,3
1032,They essentially become the localised Docs Team,3
1033,similar question: if someone creates a PR for github gutenberg docs. they get a core badge,3
1034,should they also get a documentation badge?,3
1035,"If they already get a Core Badge, we won't double it up",3
1036,"hm, if someone creates a patch improving the docs for a function, shouldn't he/she receive a docs badge too? (about doubling it up)",3
1037,they automatically get core badge,3
1038,"yep, I know, but shouldn't they receive a docs contrib one?",3
1039,They are improving in-line docs for Core,3
1040,"only if they do things with examples, I guess",3
1041,We've almost gotten to the point that we no longer handle in-line docs.,3
1042,In the similar way we no longer handle handbook changes for other teams,3
1043,(We used to),3
1044,"makes sense, thanks",3
1045,"and about localized HelpHubs, that will require some locale reps, right?",3
1046,"The previous Docs Team lead @drew has commit access. Unfortunately, I don't. So the in-line docs piece has become something that is less reachable to us.",3
1047,"Please @Kenshino (Jon), could you explain this further? ""Docs Team. Cause it's not just translation, they're gonna have to learn how to write good docs in their language""",3
1048,@nobnob - As you say in your profile. Language is poetry. Writing good Docs is potentially different in other languages,3
1049,"Besides that, i do also expect the locales to follow the best practices set by the Docs Team and localise such practices",3
1050,All right! Clear!! Thank you!,3
1051,So do we have a consensus on how we should handle Contributor Badges?,3
1052,@felipeelia and I agree<g>,3
1053,"we've been discussing about the contributor badge for a while now, trying to reach a number of X micro contributions",3
1054,in giving contributors a badge with their first contribution,3
1055,"on my last comment there, I've suggested to give the badge right away, just as core and meta",3
1056,no matter how small the contribution is.,3
1057,@felipeelia I just posted an agree with you. There is precedent on other teams and make the contributor seen right away - I think it's the best onboarding tool we have,3
1058,we would need to post a list of contributions,3
1059,we can call the contributors to request for badge.,3
1060,"on the handbook ""how to contribute""",3
1061,"""Fix an article
Create meeting notes
facilitate a meeting
reporting an issue on the comment form?
Creating a PR for Gutenberg docs
user notes on code reference
write an article on HelpHub
update an article on HelpHub
migrate a page to DevHub
Report an issues 
(edited)",3
1062,"I'm leaning towards any significant contribution. We can list down the significant contribution.
My worry is that if we say that fixing a typo is fine - we'll have a rush of requests to do that to farm badges.
We don't have a system like Core or Meta which insists on people adding patches. We'll have to individually lookin at these fixes and either add users or make the fixes ourselves.",3
1063,"yeah, but:
People receive core/meta badges sending a 1-line patch
Coming in here and reporting the small typo does require some effort
(edited)",3
1064,Working out how to communicate a fix to the Docs team is a significant step. even if the contribution per se is just a typo fix.,3
1065,That is those workflows are about,3
1066,Fair enough,3
1067,"But the moment I see abuse, we're gonna tighten it okay?",3
1068,"Regarding Team badge, btw, you shared a spreadsheet but that wasn't editable @Kenshino (Jon)",3
1069,(during the last meeting),3
1070,Yeah sorry I didn't get to reply. Adding an openly editable doc where I can't easily track which is real / which is not yet added and so on is gonna be tough. I'd suggest we setup a system where by a few of us can edit the sheet. These people should ideally be running projects within the Docs Team,3
1071,"These people can verify that X, Y, Z should get the Team Badge",3
1072,"How many on this team are able to give out badges? Is it just @Kenshino (Jon)? if yes, Jon, you could come up with a routine, that fits your workflow...",3
1073,makes sense. I'd say to keep it sync with this: https://make.wordpress.org/docs/handbook/the-team/,3
1074,"I'm comfortable with that. Which puts the onus on each project reps to get names into the doc.
I'll submit once per month",3
1075,That's seems quite doable.,3
1076,What are the goals of the survey? This started before I joined so I  need to do some catching up... And who is target audience?,3
1077,And has the doc team done surveys before?,3
1078,"General theme: ""How can we improve our user docs""",3
1079,Not in the last 3-4 years @bph,3
1080,"At the end of the survey, I'd like to have enough info to know what else we can do about our user docs (HelpHub) so we can directly focus our dev and content efforts in the right areas",3
1081,Are the questions and results from the last survey archived?,3
1082,That's the last question ^^ for today<G> on the survey (edited),3
1083,We've never done such surveys and potentially never any. If we did it would not have been in recent years and I doubt we shoud take those as basis,3
1084,What about a P2 to solicit questions and answer sets?,3
1085,and other comment?,3
1086,"As WC Asia is coming, @zzap told us it would be nice to reach an agreement on two items: Team Workflows and Badges distribution (edited)",3
1087,@zzap are you there? Do you want to explain those items?,3
1088,"yes, so the workflows refer to reporting an issue
we have trello board for that: https://trello.com/c/GNXYppYS/44-workflows",3
1089,"I believe that most of workflows are covered, if not all",3
1090,"meanwhile, I'll start google doc with the workflows we have in trello",3
1091,"so we can work on wording and tiding up, and adding all the workflows added later",3
1092,and hope to have that page published in the first week of February,3
1093,"about badges, let's everyone please finish up discussion by the end of this week so I can start working on P2 proposal",3
1094,it's here: https://make.wordpress.org/docs/2020/01/08/documentation-team-profile-badges/,3
1095,leave your comments and questions,3
1096,then I'll publish proposal at p2 and if we all agree we could start applying it,3
1097,can I ask you a practical question about our team?,3
1098,hopefully at WC Asia we'll have some new badges,3
1099,shoot @felipeelia,3
1100,Could we in the meantime update team badges for those of us recently joined?,3
1101,"for example, before our meeting @nobnob pointed us an error on one of our docs. He could not fix it himself, so he came here and told us. Would he receive the docs contrib badge?",3
1102,"(sorry for using you as an example @nobnob, I hope you don't mind)",3
1103,@felipeelia that is exactly the subject of our discussion. What is contribution to docs team and how much of it is needed for a badge,3
1104,and the fact that we don't know is frustrating to many contributors,3
1105,"I'm going to chime in on this discussion. On the design team, we do triages and people who participate on triages, do not receive a badge because that is a micro-contribution",3
1106,"Only those members with a specific project or role in the team, are the ones that receive the badge",3
1107,those are basically the parameters for design,3
1108,"Only those members with a specific project or role in the team, are the ones that receive the badge
This would be for the team badge, wouldn't it?",3
1109,that's why it's important to have everyone's input and that everyone agrees,3
1110,not sure we are talking apples to apples here... The team badge is one thing and that's what design team has.. I don't think design has contributor badges... like the docs team has or the community team has...,3
1111,"@estelaris yep, same for us at Accessibility team",3
1112,^^ I could be wrong about the design team..,3
1113,we have both contributor and team badges,3
1114,"forums team has a 1,000 replies goal to receive the contrib badge. Becoming a moderator comes with the team badge",3
1115,@clorith I think it's actually 400 replies for contributions on the support team... (edited),3
1116,"Our (docs) team badge seems to be simple... we have a team page, it one name's is there, he/she needs a badge (team)",3
1117,the design contributor badge is because I am involved in a specific design project (in this case it is the re-design for HelpHub),3
1118,"Yeah, 400 replies, we might adjust that though, it's a trial run while we try to find a good number that works",3
1119,"(from where did I take that 1,000 number? sorry and thanks @bph and @clorith)",3
1120,"And of course, rosetta sites have their own criteria, and they just report in to us",3
1121,"Right, so I think we might have a better discussion when proposal is published.",3
1122,we usually check for 400 meaningful replies too,3
1123,"yeah, meaningful is a key",3
1124,"alright, so I'll start working on proposal this week, everyone is welcome to continue discussion at p2",3
1125,Contributor Badges are harder to define,3
1126,"Team badges are easy - if you have a defined role and you're attending regular meetings, please put your name here - https://docs.google.com/spreadsheets/d/1hAPORz_yl4UTerPo8Tl5j_Xznfpm_NItrNftoXwBqvA/edit#gid=539648984",3
1127,I will give you the badges,3
1128,"also people who facilitate meetings and take notes should get a team badge too, correct @Kenshino (Jon)?",3
1129,(we also should talk about these folks someday: https://make.wordpress.org/docs/pledges/) (edited),3
1130,I'd like those people to have a specific role within the Docs Team. Facilitating meetings should be a task we all share and can be quite an entry level task to join us,3
1131,I'm gonna share more specific thoughts around that but here are some highlights,3
1132,"Yes, maybe it's better to leave the discussion evolve in p2 for a while so everybody have time to participate",3
1133,"We want it to be accessible but not game-able. Setting it to any contribution to get a badge makes it too easy and it makes the badge meaningless
Team badges need to be given on a term basis. If people stop contributing regularly without cause, then they shouldn't retain team badges.
(FWIW, I can give and remove badges) (edited)",3
1134,"yeah, discussion is going in similar direction",3
1135,How can people contribute? - Fix an article? Create meeting notes? What else?,3
1136,I can do an audit of the team badges and remove anyone that isn't on the team,3
1137,"also, many folks here should have this badge a long time ago, we want to fix this",3
1138,I'd like to give some allowance for people with great contributions to retain their team badges. E.g. Previous Team Leads etc,3
1139,"Nice. Let's have this discussion on p2. It's also good because it gets better documented for the future as well. So anyone interested in share thoughts or ask questions regarding this matter, please leave a comment in https://make.wordpress.org/docs/2020/01/08/documentation-team-profile-badges/",3
1140,"Custom Fields page@joyously brought the topic of Custom Fields article in HelpHub (https://wordpress.org/support/article/custom-fields/), which is missing some information on how to diplay the custom fields (original codex article: http://web.archive.org/web/20160301204600/https://codex.wordpress.org/Using_Custom_Fields)@Kenshino (Jon) and others argue that this is end-user docs and should not have this kind of information. It should have a link instead.@felipeelia suggests to link it to: https://developer.wordpress.org/plugins/metadata/rendering-post-metadata/",3
1141,I'm with @felipeelia here. That should be in plugin handbook,3
1142,Me too. It's actually in the Theme handbook. But that page could be extended with more complete examples,3
1143,A side note about that page: shouldn't we decide on meta-data or metadata? We have both there.,3
1144,good point. I would go for metadata,3
1145,I think it's metadata in code as well,3
1146,Yes.. never saw meta-data anywhere else,3
1147,I use meta data when writing,3
1148,But happy with using metadata for consistency (edited),3
1149,Ok. second point is to remove of Bitnami in the multisite considerations article: https://wordpress.org/support/article/before-you-create-a-network/ (@René Hermenau suggested) and also do not encourage beginners to use multisite,3
1150,@atachibana agreed with that and said he could do it if no one opposed. Do we have an opposition?,3
1151,"+1 for removing Bitnami link
-1 for ""not encouraging beginners...""",3
1152,"it IS a feature (a good one by the way), we just need to explain it better",3
1153,we could also have a better documentation on multisite so that beginners can see it's not that simple,3
1154,"Yes, that second one could be done in several ways, so it's hard to tell what is ok. Maybe it needs more discussion",3
1155,Maybe @atachibana could make a proposition,3
1156,Or @René Hermenau,3
1157,"At least, we should mentions demerit",3
1158,"I think that multisite has more than one purpose and it make sense in different ways. But call me biased 
 (edited)",3
1159,Plugin might not run or so,3
1160,"a good ""Pros and Cons"" list?",3
1161,"caveats, warnings",3
1162,Remove Bitnami,3
1163,"Also I have a challenge on the whole ""most plugins don't work for multisite"" assumption (edited)",3
1164,Explain which workflows fly with multisite and what are the things you might watch out for,3
1165,"Since you can install plugins on subsites regularly, they'd work. They just might not have network settings / network activation",3
1166,Some bad coded plugins might break. e.g. hardocoded table names... but its an edge case. Surely not most plugins,3
1167,We explain it in our faq. pro and con of multisite -> https://multilingualpress.org/docs/wordpress-multisite-pros-cons/,3
1168,And we divide a plugin’s compatibility with WordPress multisite into three categories: https://multilingualpress.org/docs/wordpress-multisite-compatible-plugins-the-definite-list/,3
1169,"I'm a pretty huge advocate for default installing multisite 
 But that's also because I know WP very well and I'm a dev",3
1170,In my opinion we should give people some examples and some downsides.,3
1171,No marketing just documentation,3
1172,"Big fan here too as well and have done quite a bit of work on it, would be awesome to see a run of adoption again",3
1173,We don't want to sell the multisite feature. We want people to make an informed decision (edited),3
1174,that's the spirit,3
1175,"My question: Should the documentation for Gutenberg End User have a section for features only available in the plugin? They are future features for Core, so it might make sense to have a future features / changes.",3
1176,I guess as long as it's clear that it's not available in core yet...,3
1177,I think it should only feature Core info,3
1178,"We can mention to every GTE of each Spanish locales to notificate them about this ideas. I only know @abrahammoca and @tokyobiyori, what do you think? (edited)",3
1179,I think this is a good chance to work together. Dominican Republic/Honduras/Puerto Rico teams seem dormant,3
1180,"Yes, there are many Spanish locales almost no translations.",3
1181,Tomorrow I can find the username of every GTE from Spanish locale and mention them to talk about the collaboration in the translation milestones (like HelpHub).,3
1182,"I think the best idea is use a channel in this Slack or a channel in the Spanish Slack, but I think this new Slack is not a good idea",3
1183,"I believe the new space is good, but if will be better if we have a channel here, don't you think?",3
1184,"I think the new instance can be a very nice begin, to be honest",3
1185,I use 2 Slacks for WordPress: the global and the Spanish. I think one more it is too much,3
1186,Create a new channel here seemed to be the solution for a non-existent problem (we have too few interactions between Spanish speakers here),3
1187,I understand your point of view @Jesús Amieiro. It would be nice to have that feedback on the P2 post I mentioned (let me grab the link),3
1188,I can talk with an admin of the Spanish Slack and make a channel for this (https://wpes.slack.com/),3
1189,"I agree with @Jesús Amieiro, maybe the people get overwhelmed with three (or more) spaces.",3
1190,@Jesús Amieiro the problem I see in create the channel in the official es_ES Slack is the limit for free spaces: just 10k messages.,3
1191,"The messages will be lost very soon, if a person arrive late, maybe lost the chat.",3
1192,We have a 10k limit for Brazil slack and it takes sometime to hit it,3
1193,It actually fills faster than you expect,3
1194,"And the history is also a good tool to find info, that's one of the benefit of having a spanish channel here.",3
1195,We have 91k for WordPress Russia,3
1196,The problem I see of this channel being part of a specific locale is that people from other locales will have to join a third slack anyway,3
1197,@felipeelia The official Spanish Slack space is very active (edited),3
1198,In the Spanish Slack you can find a lot of people from South America. This Slack is very active,3
1199,I think a global Spanish here may be quite useful. Somehow we still need to follow through with that discussion. As a stop-gap Ali created the new Slack team.,3
1200,"Of 13 spanish locales, I think just Spain have it active, but that space is a free one.",3
1201,"But with a spanish channel here just for discuss topic related to translation, I think we will work very well.",3
1202,"(Pretty much like we created a separate team for Translationday, before we got #polyglots-events  here.",3
1203,"Please note that Spanish official slack isn't only for translation, but for all topics related to WordPress (edited)",3
1204,"I believe that the Spanish community might need to point out the benefits around that on the p2 post that @felipeelia provided. I tried to put my point of view there, but I am not part of the Spanish community, so it won't even affect me directly.",3
1205,"Honestly, the cooperation between Spanish speakers seemed to be very small for non-Spanish ones",3
1206,How do you cooperate between 3 different pt_ locales?,3
1207,And that was a problem while we were suggesting the new channel: it seemed a solution for a non-existent problem. Why to have a channel to separate a conversation that does not exist,3
1208,"Brazilian Portuguese is very different from Angola and Portugal 
 I do know they cooperate, though",3
1209,"I'm trying to redirect people to new space (https://spanishpolyglots.slack.com/), but I feel skepticism between members.",3
1210,Do you see some reasons for that skepticism?,3
1211,We could work to convince them somehow,3
1212,"People have a lot of Slacks (I am active in 5). Not one more, please",3
1213,"Switching between spaces is very exhausting and honestly, thats the main reason. I don't see issues in creating a new channel like #polyglots-espanish or something like that.",3
1214,"Easier, of course, is to just join one more channel here in the global team.",3
1215,I jump easily forth and back between 4 Slack spaces regularly. But agree totally that keeping it within one team (and with retained history) is even better. (edited),3
1216,"Nice, we all agree with that. So, I'll kindly ask you to leave that feedback on that P2 post, that will show our interest in the new channel. In the meantime, The new slack instance will be there to help coordinate efforts",3
1217,And somehow address what we can do to handle fears of spam and that the foreign language channel will be used for wrong things...,3
1218,The Spanish people can report this to an admin if it occurs,3
1219,"It's a good idea to clarify that channel will be use just for translation topics, specially sharing efforts between locale teams in translation (that's the original idea)",3
1220,"sharing efforts between locale teams in translation
Yes! Please point that out on the P2 post too... the channel main reason is still to be clarified",3
1221,"He did have one question for us,
I didn’t commit my db back with the code (its pretty), so I see there’s some data work to be done to get it going on the test site. If you would like, I can clean it up a bit and export?",3
1222,Which data? Does he added any options field?,3
1223,"I can see upsides and downsides to this- the posts should be automatically imported based on our repos, so depending on what changes he made, we may need to get him to commit his db into a different branch, so we can make sure the plugin is importing the posts the way he needs them",3
1224,I see that new post and taxonomies are added. So I think we can commit db.,3
1225,Yes different branch will be better,3
1226,"Sounds like we agree then, I set up the branch https://github.com/wptrainingteam/learn-theme-beta/tree/stevedb so we can check it out, and I'll let him know to PR it over there",3
1227,"Yesterday, I was trying to explain in a forum question about comments how the Discussion options work, but was confused a little myself when I check the current version. Because of this ticket https://core.trac.wordpress.org/ticket/38517 that went into 5.3, it says ""comments on posts"" instead of ""comments on articles"", which implies that those options only apply to Posts. They do apply to all post types with comment support, but I think that kind of got lost in the change. I made a comment on the ticket, but it's already out the door...
I guess I was wondering either A) what can be done to prevent that happening again? or B) can it be fixed?",3
1228,"I'm sorry, but that's... a core ticket, and not a support thing",3
1229,"I know, but it is about support",3
1230,"The user can't tell what the options apply to, and I couldn't state with certainty anymore either.",3
1231,"Right, but there’s really nothing we as a support team can do about that. This is a great argument for the Trac ticket however, and that might get the developers to change their minds.
The best we can do as a support team is just make note of the change.",3
1232,Maybe a few of you could comment on the ticket?,3
1233,It really only shows up in support.,3
1234,"Because all of the people that already know, don't see it.",3
1235,"I don't think it makes sense to spam a ticket with ""yes, this"" replies. The ones who worked on it get notified when a comment is posted, so they'll see a remark was made and can look into it (time permitting)",3
1236,"Well, when I made my comment, I saw that nobody was listed at the bottom...",3
