,Text ,Code
1724,I have some follow up re. migration but I think i’ll wait until Open Floor,4
1725,ditto,4
1726,I’d love to help automate as much of it as possible,4
1727,we could focus on that at WCAsia CD,4
1728,@bph want to share anything on this topic?,4
1729,@felipeelia didn't check in but has a green ball by the side of his name. So we ping him as well,4
1730,Yes! thanks @zzap,4
1731,(note to self: read last meeting notes before facilitating a meeting),4
1732,"OK, I will follow.",4
1733,ok. So everyone: Last days to share your thoughts on the survey!,4
1734,do we have any focuses @Kenshino (Jon) @atachibana?,4
1735,Oh stats are nice,4
1736,https://docs.google.com/document/d/1-eYk1Xcwo27PLq_tKEcW2Pa7tngrGjLbK05onazfFmw/edit?usp=sharing,4
1737,"yes, please share here",4
1738,mostly related to the Explanation post type setup,4
1739,https://meta.trac.wordpress.org/ticket/5017,4
1740,https://meta.trac.wordpress.org/ticket/5015,4
1741,https://meta.trac.wordpress.org/ticket/5018,4
1742,5018 here I’ve submitted a patch to as well (edited),4
1743,Very nice,4
1744,I’d love some feedback re. 5017 for instance,4
1745,"Yes, it was @netweb",4
1746,"This would be really useful, because we do have a bottleneck right now",4
1747,"Some updates. We had some progress on pt-BR docs. It's not huge, but it's something: 
5 translated pages
1 page in progress
+1 contributor last week
We will have our local docs meeting on Feb 24 and I will inform them about the Documentation badge updates as well.",4
1748,@leogermani not sure what this is about?,4
1749,oh the points at the beginning of the meeting,4
1750,my ticket 5018 tunes in here too…,4
1751,"@themiked I’ve seen you struggle with code formatting over the past few days, right?",4
1752,@leogermani the redirect itself didn’t seem like a big deal; AFAIC it was just a shortcode insertion,4
1753,"yes, it is. But it takes a bit of time. When you are doing many pages at once... anyways",4
1754,(I hid some old tabs),4
1755,"I submitted Jan's badge list last night or today morning. Once that is clear, I assume everyone that should have a badge has it and we can clear up that list properly",4
1756,I think it'll fit our needs (edited),4
1757,"I noticed a duplicate documentation under different categories, is that intentional? Let grab the links",4
1758,https://wordpress.slack.com/archives/C02RP4WU5/p1580739514323000,4
1759,@atachibana is that the code reference for functions?,4
1760,Yes for functions,4
1761,I have to get back working on hooks,4
1762,One more question @atachibana - so that means 447 are fully redirected?,4
1763,"What do you mean fully redirected?
Now, If you go to the Codex page, 1) automatically redirected to Code Reference, or 2) language locator and link exist.",4
1764,Yup I mean sometimes we migrate pages but the examples aren't complete,4
1765,And therefore the redirect isn't put in place,4
1766,I see. Above 447 pages include fully examples.,4
1767,Thank you @atachibana!,4
1768,Let's chat a little deeper next week about that effort,4
1769,he thought it'll take more time,4
1770,Yes I did!,4
1771,yes. it's here https://docs.google.com/document/d/1kZ27_w9crNpZ2gDyi58Mt2JK1gd88u94I4dwK6FR1xg/edit?ts=5e3826a8,4
1772,I can't keep track of all these places,4
1773,@themiked just Make / Docs basically,4
1774,is it intended for en_* only? (edited),4
1775,so this is about documentation of Docs team? It's not (edited),4
1776,added a sentence to asked for volunteers,4
1777,It's HelpHub focused,4
1778,@themiked Yes - the international docs are the canonical source,4
1779,Our presence at WordCamp Asia,4
1780,Please keep chatting async anytime in this channel to talk about how we can garner more interest in WordCamp Asia's Contributor Day,4
1781,"BTW @estelaris posted a first draft of the feedback section on HelpHub pages for people to report issues. https://meta.trac.wordpress.org/ticket/4915#comment:16 Thanks, Estela!!",4
1782,oops sorry @Kenshino (Jon),4
1783,"sorry, I keep posting in between....",4
1784,Yes ^,4
1785,"Workflow docs are being constructed on trello (@zzap is the one to ask for access if needed 
 ). I guess there is not that much of discussion about it.
Badges are being discussed in this P2 post: https://make.wordpress.org/docs/2020/01/08/documentation-team-profile-badges/",4
1786,Regarding helphub any progress for the survey,4
1787,Any progress on multisite docs,4
1788,are we at the question part yet?,4
1789,two questions actually,4
1790,K well maybe I'll just ask,4
1791,@atachibana,4
1792,Sorry just going back to the last topic a little,4
1793,"But, survey's idea was came from @Kenshino (Jon)",4
1794,"Anyway, I don't have any progress. I'll prepare something until the next meeting.",4
1795,@zzap started a very nice convo about getting more volunteers here:,4
1796,https://wordpress.slack.com/archives/C02RP50LK/p1579517985002900,4
1797,https://wordpress.slack.com/archives/C02RP4WU5/p1579535377106800?thread_ts=1579532565.033500&cid=C02RP4WU5,4
1798,atachibana (edited),4
1799,leogermani,4
1800,milana_cap (edited),4
1801,audrasjb (edited),4
1802,marcio-zebedeu (edited),4
1803,wpza (edited),4
1804,kenshino,4
1805,-> nullbyte (edited),4
1806,"Yes, I was going to add something on devhub but did not. I can do this...",4
1807,Ah let's clarify that a little,4
1808,That's lovely,4
1809,"for gutenberg dev handbook, can we have a workflow defined by @pbrocks?",4
1810,That guy is out to lunch,4
1811,and needs to connect with @bph for marching orders,4
1812,"lovely, please do",4
1813,will take discussion out of meeting,4
1814,"Thank you @zzap for creating the topic, all can share their inputs there",4
1815,Thanks for doing that @zzap i keep dropping it from my plate,4
1816,"sure, no problem",4
1817,"I have a question on that matter, if you don't mind",4
1818,we already discussed all that,4
1819,once we have all those things defined we can add those pages to docs team handbook,4
1820,Progress of the survey,4
1821,was this something @bph was working on?,4
1822,"Sorry, I've been away for a while... what survey?",4
1823,Well actually @atachibana,4
1824,Nope... actually I've been a bit away from that too... @felipeloureirosantos has been running this for us (pt-br community),4
1825,We don't have updates there so far as well. There will be in the next weeks.,4
1826,https://meta.trac.wordpress.org/ticket/2082,4
1827,ok ok,4
1828,you it is,4
1829,@atachibana do you own this one?,4
1830,"No 
 Anyone can do it.",4
1831,for sure,4
1832,If so @Pascal might be able to help?,4
1833,Let's do it!,4
1834,@bph had a question for open floor,4
1835,"on the design front for HelpHub, the only update I have is that the design team has requested a number of changes in the mobile version, including the menu. After I present these on Wednesday, I will be able to move forward. The only missing design now, is the page for WP versions",4
1836,"Nice, thanks @estelaris",4
1837,first we made progress on the meta-trac ticket. https://meta.trac.wordpress.org/ticket/4915 feel free to comment,4
1838,Hi @YordanSoares. Any Achievements & Open Floor item to share from your side? (I know you got a lot done last week!),4
1839,Nice collaboration!,4
1840,"So, there are a lot of work to do",4
1841,Sounds really good. I hope many of Spanish variants will get to smoothly release 5.4 at the end of this month.,4
1842,"Any comments, so far?",4
1843,-- (edited),4
1844,Previously we had to wait some 10 hours (give or take),4
1845,"Hope to see you! I’ll post it on P2 soon.
</end>",4
1846,Cool!,4
1847,"example: https://translate.wordpress.org/locale/ru/default/wp-plugins/gutenberg/
we have fully translated Gutenberg plugin, PTE is Otshelnik-Fm",4
1848,No more questions from me,4
1849,"Thanks, @yui for a good explanation",4
1850,Note that en_GB and some other English locales ARE translated versions (as WordPress handles them),4
1851,Yeah. We've hit much higher than we ever could imagine.,4
1852,We are done here.,4
1853,"the /about/stats page is down since a couple of days, probably the root cause of the problem, btw",4
1854,↑ Sounds plausible.,4
1855,The link: https://wordpress.slack.com/archives/C02RP50LK/p1579517985002900,4
1856,That's a big one!,4
1857,Have you translated anything so far in 2020?,4
1858,@felipeelia Are you set for the Americas chat later today?,4
1859,Thanks i ll take a look,4
1860,Ok sure will do that,4
1861,"notably: https://wordpress.org/five-for-the-future/for-individuals/
(update your profile)",4
1862,This is a relatively new piece of functionality.,4
1863,Reference link: https://make.wordpress.org/polyglots/2019/10/17/measuring-polyglots-team-success/,4
1864,:ad,4
1865,:S,4
1866,Yup.,4
1867,Thanks for your feedback Khoi!,4
1868,I’m interest with that kind of promote,4
1869,"@atachibana and I talked about it, docs badges should be granted to to contributors.",4
1870,Also @YordanSoares shared this online event with me (this is the one we mentioned before but rescheduled to December 6th).,4
1871,yeah! great!,4
1872,"https://make.wordpress.org/docs/handbook/helphub/translating-helphub/
You’ll need to request HelpHub plugin to be enabled first.",4
1873,I just have curiosity about translation for Korean.,4
1874,@chat.wordpress.org*,4
1875,https://make.wordpress.org/polyglots/2019/11/07/slack-channel-for-communicating-across-language-variant-teams/ (edited),4
1876,"And again, it would be very nice to see some movement from you folks here in our channel 
 (edited)",4
1877,"Sure, I will.",4
1878,"Please, remember to write your point of view on the P2 https://make.wordpress.org/polyglots/2019/11/07/slack-channel-for-communicating-across-language-variant-teams/",4
1879,"Last meeting we talked about some Coming Locales. I guess we didn't have any movement on that front, did we @tobifjellner?",4
1880,No. Sorry.,4
1881,Currently 12 requestss in quueue https://make.wordpress.org/polyglots/?resolved=unresolved&tags=locale-requests (edited),4
1882,"A couple of patches the the locale list, which now resides in our meta environment.",4
1883,"Nice, I didn't know that would involve patches and this kind of stuff",4
1884,in https://make.wordpress.org/polyglots/handbook/tools/ (edited),4
1885,"Do you have a link to it, @YordanSoares?",4
1886,Yes: https://www.youtube.com/watch?v=ZQm4kULOhCw,4
1887,Mini-wp-translationday,4
1888,"Awesome, thank you!",4
1889,"Sure, we can discuss how to do it.",4
1890,"Huh: rule #1: popularize translation of WordPress
Rule #2: see #1",4
1891,https://wordpress.slack.com/archives/C02RP50LK/p1575441540303100,4
1892,Does anyone else have any questions about HelpHub i18n?,4
1893,"We have a problem with the main page to https://ve.wordpress.org/support/, return an error. It seems to be due the fact we haven't a forum in our locale page. Maybe that topic isn't for this team, but I leave the reminder just in case.",4
1894,There is some ongoing discussion about HelpHub and locales without a forum,4
1895,I guess we have meta team already working on that,4
1896,@nao and @tobifjellner can confirm that,4
1897,At least there's a ticket for it.,4
1898,"Nice, let's hope they can find the necessary time to work on that soon",4
1899,Do you want to talk about it @nao?,4
1900,Please talk to your teammates in local Slack or message group. I’ll prepare a way for you all to enter it in to collect the results. Maybe a form or spreadsheet?,4
1901,"Nice, thanks @nao!",4
1902,And that made things fall behind the schedule.,4
1903,"Sure, I do this (edited)",4
1904,Same here.,4
1905,I must update my repo again,4
1906,Yes. You are right.,4
1907,Any other updates?,4
1908,Thank you,4
1909,No problem!,4
1910,Anyone coming to wcasia?,4
1911,"A colleague of mine will be there, but unfortunately I'm not able to attend",4
1912,ohh,4
1913,"Nope, I read through the page. I'm very interested in getting involved.",4
1914,"Ok, I just did the form as well if that helps",4
1915,"Ah perfect, I'll grab that now",4
1916,"I'll follow up more for DC for contributor day as we get closer.  I know we have had a large contingent of Training team members from the region, and others familiar with Make teams overall.",4
1917,"i may attend DC wordcamp, if i do i'll probably show up for the training team again since it was fun last time",4
1918,Good!,4
1919,Great work!,4
1920,Nice,4
1921,Thank you @Steve Dufresne,4
1922,That is great progress,4
1923,No from me.,4
1924,Nope,4
1925,"I'm still trying to figure out how @juliekuehl was using ZenHub to track PR's across all the repos, but I know we have some folks getting close to earning a badge",4
1926,"I’m looking forward to getting back to working towards my badge, the early morning meeting time was not ideal. Made me forget about it!",4
1927,Does anyone else have updates on any Trello tasks?,4
1928,Not related to Trello but We have got few PRs from @passoniate for some lesson plans and I have merged them. Let’s thank him for contributing. Thank you,4
1929,I had been working on the ‘What is CSS/Introduction’ (been a while now I can’t remember the title) before Christmas but didn’t manage to finish. There are a few sections that I need to update and then I can hopefully submit this for a review. Not sure that it will be done by end of January but definitely by end of Feb.,4
1930,"Yes! I believe he's made 3 copyediting PR's, so he's close to a badge",4
1931,"Ah, OK Hauwa, I think maybe Julie took you off of ""Owner"" for that, but if you're still going on that, awesome!",4
1932,"Yes, still cracking on.",4
1933,"Awesome, good to hear, I went ahead and updated the card for you. You've done great work on that one so far",4
1934,"Awesome, thanks Morteza. Hi Chetan!",4
1935,Hi Jesse. I have not any updates for Learn theme this week.,4
1936,"No problem, I know you were probably very busy with the 5.3 Release you were working on!",4
1937,"What is CSS - I had a look at some of the comments made and they wanted me to flesh out the Exercise Descriptions, Assessment Questions, and Full Example Lesson. I’m assuming that the high level information is fine so I’m going to work on that this afternoon.",4
1938,please let me know about Lesson Plans and to whom we are going to train?,4
1939,No update from me at this time.,4
1940,"Whoops, sorry my Slack crashed there for a minute",4
1941,Awesome! Hi @courtneyengle thanks for lurking!,4
1942,"Here's what instructional review means:
https://trello.com/c/1TBXximw",4
1943,"I just volunteered her for that without her knowledge, but it's better to ask for forgiveness than for permission",4
1944,I'm fine for now just catching up,4
1945,Would appreciate it if someone would look and let me know if I’m on the right track,4
1946,https://github.com/wptrainingteam/what-is-css/pull/1,4
1947,Yup that’s it.,4
1948,],4
1949,Next year may be,4
1950,Sorry jumped on a call. Nope no plans in the future.,4
1951,"No worries @Hauwa Abashiya, thank you very much for your work on the What Is CSS lesson!",4
1952,nothing from me for now.,4
1953,"And let's give @Hauwa Abashiya a round of applause for submitting her lesson plan! At a glance, it looks like it was a lot of work!",4
1954,@Hauwa Abashiya,4
1955,Thanks. I still think there is more to add but wanna make sure I’m on the right track before continuing,4
1956,"For sure, we'll make sure you get the feedback you need.",4
1957,Awesome! Will there be a contributor day there?,4
1958,We'll let Chetan follow up on that later as he's on mobile.,4
1959,"Awesome, thanks for all your hard work on this one!",4
1960,"Looks like I'll need to take a look at them before merging, @man4toman does any of this look like it conflicts with your PR?
https://github.com/wptrainingteam/learn-theme-beta/pull/56/files",4
1961,That’s not to say we can propose something closer to 44,5
1962,"I can see that the GitHub issue was given the label that it needed accessibility feedback on Dec 11. But we never saw it. Now, two months later, it looks like they’re going ahead without our feedback. Maybe we need a better way to stay on top of the things people are asking for feedback on?",5
1963,"Sorry if I feel pessimistic about that, but I think it might be just another channel that nobody is really looking at...",5
1964,"I need to do some re-testing; the notes in the testing column weren't always complete enough for me to categorize some of the problems. I haven't had time for that, yet.",5
1965,"But they're mostly grouped by type of concern, just missing one set of labels.",5
1966,"I don't really know how Github projects work, but I can probably figure that out.",5
1967,"I’m happy to help figure things out in Github, if you need",5
1968,I can set up a document and share with y’all later today,5
1969,I’ll set up a document and share here it later then. Hopefully we can have a few us do some testing and provide any feedback we find,5
1970,Does anyone have suggestions on running a Meetup/Workshop for meetup organizers?,5
1971,"In your local group, or globally?",5
1972,"Local area of 14+ organizers: how to build group, topics, enhance sense of belonging, etc.",5
1973,I think going over similar topics that were discussed in the Meetup Roundtables a while back would be neat!,5
1974,https://make.wordpress.org/community/2018/05/15/report-on-the-march-meetup-organizers-roundtable-experiment/ (edited),5
1975,"Excellent suggestion (I was a participant, yet forgot the obvious!)",5
1976,"We certainly do a lot on this team, it's easy to lose track!",5
1977,I think we should stop using Code names in public information,5
1978,Unless we addrsss code name + URL all the time,5
1979,It's important to be explained at project detailed page,5
1980,Because those names are used in trac,5
1981,"Other than that, I'm fine with completely removing those from public content",5
1982,So we can’t get rid of the code names entirely,5
1983,Those are components in meta trac,5
1984,"What I did, for example: ""developer.wordpress.org (aka DevHub) - This is where all the documentation aimed to developers are, such as: Code reference, Plugins and Themes development handbooks and more.""",5
1985,Or maybe we just need codenames in workflows because that's where you are going to use it,5
1986,When you contribute,5
1987,But we still need them,5
1988,Unless meta change that as well,5
1989,"In the workflows we can explain it better saying that this is referenced in trac as DevHub or HelpHub. .. and the ""aka"" mention in the more generic mentions are enough, but needed... because when some one reads that and then come to channel or read a meeting summary, he/she will know what this terms are about",5
1990,"and then we need to get back the effort with workflows and do it! 
 we could split it! but maybe we discuss this in another meeting with more people and better connection",5
1991,@Sunday Ukafia What's the next step here?,5
1992,"@Sunday Ukafia that is great that you noticed this, but we are working on a new classification for the documentation",5
1993,we are creating categories and subcategories to group all the articles in the correct place,5
1994,"My apologies, I'll just wait for the open floor then.",5
1995,and that will be part of the new design. you are very welcome to work with us,5
1996,I think your connundrum gets solved in part because of the partial information architecture review @Sunday Ukafia,5
1997,I'd love for you to help with them to provide a fresh view,5
1998,Would you like to lead an audit into those articles? People have been reporting problems but I feel that's very reactive,5
1999,"Sure, I think it's a good idea and I should have some time to get into that",5
2000,The next step would be to create a survey with CrowdSignal (do we have access?) and fill it with all the questions suggested.,5
2001,"The comments are open until Wednesday. A stated last week, I'll be on vacation Feb 13 to 19 so I can't lead this effort.",5
2002,So what's the practical task for until 12th? Just gathering more comments/questions?,5
2003,Yeah let's gather the question we want to ask and have a session to collate them and decide which ones we want to use,5
2004,I think @bph can lead the effort up till that point,5
2005,We are using the open-source LimeSurvey on WCEU (Call for Volunteers and Call for Photographers). It's a great tool as well.,5
2006,"Looking at the previous meeting notes, I see @atachibana is the rep for the survey, once @bph is off for vacation, and @themiked is available to help. Is this ok? @atachibana, would be nice if you planned some time span for people to review the form before it goes live. Please let us know if there is anything else you need.",5
2007,"I'm leaving that to you @zzap and @atachibana
I will be organising and can't really contribute on that day",5
2008,besides being close to polyglots and stealing their contributors,5
2009,"I think at the current point, we should make contributing to Docs a lot more interesting",5
2010,"OK, we'll discuss this week and have it official before next meeting",5
2011,does this work for you @atachibana?,5
2012,@Kenshino (Jon) I suggest reviewing the “barriers to entry” alongside “motivational” efforts,5
2013,Also @estelaris suggests me to organize our documentation with appropriate Categories --- Sub-Categories.,5
2014,can you elaborate @atachibana @estelaris?,5
2015,"@zzap, yes I’ll do it on our table",5
2016,I'll definetly need help writing and reviewing this pages on our handbook,5
2017,@leogermani what are the action points besides the handbook/welcome box? (edited),5
2018,"stats.. I guess the rest is with @atachibana and @zzap, including the cookies",5
2019,who takes care of retrieving stats? (edited),5
2020,thank you very much for all your inputs,5
2021,"and I need more eyes now, because it feels like all the info is there",5
2022,I am new to docs.  I'd like to know how to suggest edits to the documentation - HelpHub.,5
2023,"I want to help. I think we could create a ""task force"", split the pages that must be worked on.. and discuss some of the texts that need to be rewritten... (am I too optmistic?)",5
2024,I'm not sure we (Docs) can see stats but I'm quite sure that someone can.,5
2025,We can ask Meta for Stats,5
2026,I was told the last time I stuck my head in that wpdb needed docs work. I can do that but I don't know what exactly is needed. Do the current docs need editing? do they need to be migrated elsewhere? Guidance is appreciated,5
2027,also when I search for wpdb in this channel I see some stuff from last summer about it being worked on...is the current state the actual current state?,5
2028,"second Q: what is involved in being a ""Handbook rep""? I see the plugins one is open.",5
2029,I'll leave the docs content question for @atachibana (edited),5
2030,"RE: Handbook Rep for Plugins, I originally wanted the Plugin team to look after that.
I gave the theme plugin handbook to the Theme Review team with the belief that they have the expertise to do it and it's in their best interest to keep maintaining it",5
2031,"So the criteria fir the plugin handbook is basically
Proven expertise
Commitment to maintain it",5
2032,point 2 is what I'm curious about. Is it a 10 hour a week thing? an occasional thing? would I be making proactive changes or waiting for typo reports or change requests? (edited),5
2033,however if it's going to be done by the plugin team then I guess it's moot,5
2034,based on the spreadsheet I assume the wpdb thing involves moving https://codex.wordpress.org/Class_Reference/wpdb to https://developer.wordpress.org/reference/classes/wpdb/,5
2035,is that correct?,5
2036,I believe that's what it is.,5
2037,can someone point me at the process for getting that done?,5
2038,https://make.wordpress.org/docs/handbook/code-reference/editing-articles/,5
2039,thx,5
2040,The plugin team can't do #2 basically - they are a small team who has to review tons of plugins everyday,5
2041,"I'd say the commitment is basically -
Keeping in the loop with Core changes
Creating a team to do updates (new articles, edits, categorisation)",5
2042,@themiked the steps are basically these here: https://make.wordpress.org/docs/handbook/code-reference/editing-articles/#compare-codex-and-code-reference,5
2043,"I make fixes to the handbooks on a needs to be done basis essentially, so it could be a long time in between needing to do anything on them.",5
2044,"Plugins are a bit more static than themes though, so it's an easier one to maintain",5
2045,The Getting Started section on this page,5
2046,"makes reference to a different spreadsheet than was given earlier, which is this one",5
2047,https://docs.google.com/spreadsheets/d/15hpEbbnuWJZ0DJafyCeG3CFRMtSxX1gY-RObrrjzzdw/edit#gid=1,5
2048,do they track different things? wpdb isn't in the one linked from teh getting started page,5
2049,"also, despite my horrendous spelling in this channel I am good at documentation, honest!",5
2050,"also when I view either of them, I can read only so I can't actually reserve wpdb for myself",5
2051,this one's being used. Take a look https://docs.google.com/spreadsheets/d/15hpEbbnuWJZ0DJafyCeG3CFRMtSxX1gY-RObrrjzzdw/edit#gid=0,5
2052,I can't find wpdb in there,5
2053,@atachibana will have to give you permission to edit,5
2054,I'm happy to take the plugins handbook,5
2055,i can provide my credentials as required although I'm not super great at blowing my own horn,5
2056,"On workflows: @JNash has a system where he uses his site to bring up a page in a new tab from a second site for a predetermined number of seconds.
He uses it to systematically review his own and client sites for outdated / incorrect content.",5
2057,I”m still working on a workflow,5
2058,I'm not sure I understand @Carike,5
2059,"It could help some volunteers in the docs team to work through .org content systematically, placing less reliance on reports.",5
2060,It is a more pro-active approach.,5
2061,Can you add step-by-step in our Trello board? It might be more clear then,5
