,Text ,Code
0,Here is the agenda for today: https://make.wordpress.org/accessibility/2020/02/28/accessibility-team-meeting-agenda-february-28-2020/,1
1,"(on 
 and a terrible connection)",1
2,Next up: Accessibility team goals for WP 5.5,1
3,"well, I’ll summarize that in the meeting recap",1
4,Next item?,1
5,Update on WP Accessibility Day,1
6,@joedolson,1
7,"It's moving forward. Goal is to announce on March 25th; there's a design in the works, so we're on target.",1
8,The website is currently under construction,1
9,"Next meeting will be on Tuesday, 3 March; if anybody still needs to vote on the time, do it today!",1
10,In #accessibility-events,1
11,"Not much else to report right now - we've got a budget mostly worked out, looking for sponsors to cover the captioning & transcription costs, etc.",1
12,do we have any Gutenberg issue/pull request to discuss? (edited),1
13,"If not, we can directly open the floor",1
14,"I believe that #49517 needs some discussion with the editor team, although I think it's a very clear cut issue from the a11y side.",1
15,If @ella is still around?,1
16,"If not, then I don't think there's anything to discuss here.",1
17,"Alright, let’s close our weekly meeting!",1
18,</meeting>,1
19,"@here Ok, let’s get started then. Who is around?
Today we’ll be following the proposed agenda here: https://make.wordpress.org/accessibility/2020/02/20/accessibility-team-meeting-agenda-february-21-2020/",1
20,"Ok, topic numero uno:
Discussion on the Navigation Menu block testing.",1
21,A few weeks ago we started doing a11y testing on a new navigation block in Gutenberg. We added our results and feedback here: https://docs.google.com/spreadsheets/u/1/d/1yFCFlPK78Ryl7WT9iRhn4Xe0PpWvnzAKSzBLi6L8GHY/edit?usp=sharing,1
22,"Going over the results, I think consensus was that keyboard navigation was dificult",1
23,and it looks like the block’s release was postponed due to it not being ready for prime time: https://make.wordpress.org/core/2020/02/07/navigation-block-exclusion-from-wp-5-4/,1
24,"while the reason to postpone it was not our tests, I think this works out well timing wise. The team working on it will have enough time to go over our results and review those issues.
Anyone has anything else to add?",1
25,"Correct, @jeryj. We postponed it because while it is usable... it wasn't yet useful without proper Header/Footer areas to put it in.",1
26,I want to thank everyone for testing this out!,1
27,"Ok, thanks again to everyone who was able to help!",1
28,Thanks for those that dove into this.,1
29,"If there are items that are smaller that don’t need as much direction regarding the keyboard nav, I have time today to look at it. I was wanting to help fix keyboard navigation with the navigation block, but am nowhere near knowledgeable enough with the accessibility of it to know what to actually do. I’ll follow along in the Github issues to hopefully help out and learn more 
 Thanks for your work on it!",1
30,"That’s great @jeryj, thank you! Once I have those issues up in the GitHub repo I’ll share them here.",1
31,Let’s move on then.,1
32,Next item is Discussion of team involvement in Gutenberg development,1
33,"ok, let’s move on while we still have time",1
34,next item is a Trac issue: #48894,1
35,@joedolson @Dani Hooven @afercia would you be up for following up on this?,1
36,I can try to dedicate some time now that I’m relatively settled down after my moving.,1
37,"LOL! And on that note, let’s finish our meeting then.
Thank you all for coming. Hope everyone has a great weekend 
</meeting>",1
38,Would anyone like to help with creating an issue as Mark suggests and adding our feedback there?,1
39,"Anyways, we’re derailing",1
40,But we should probably move on in the meeting.,1
41,"I’m going to move us along then, we have more topics on the agenda. Next item is feedback on a new TabPanel component: https://github.com/WordPress/gutenberg/issues/13587
Feedback is required on how keyboard navigation between tabs should behave. Currently on the editor sidebar, tabbing moves you to the next tab, but an enter is required to open such tab. There’s a new TabPanel component being developed that started by adhering to WAI-ARIA practices, where keyboard navigation differs a bit. If I understand correctly, navigating between tabs is done with the keyboard arrows, and tabbing enters you in the tab’s content. 
The question being asked is, which method should they use. (edited)",1
42,"We’re way past the hour, but before we leave, I’d like to remind everyone to vote for a date for the next WPAD planning meeting. You can vote here https://wordpress.slack.com/archives/CM6KEHYCR/p1581612505083800
 Thank you all for coming. Hope y’all have an excellent weekend. </meeting>
Please continue the current conversation, the channel is open 24/7.",1
43,"We’ll start the team meeting in a couple of minutes. Let’s give everyone time to refill their 
 / 
 / 
 /etc.",1
44,Here’s today’s agenda: https://make.wordpress.org/accessibility/2020/02/06/accessibility-team-meeting-agenda-february-7-2020/,1
45,Thank you all for being here! Let’s get started then…,1
46,"First item on the agenda is Discussion on the accessibility status of the Gutenberg sidebar.
This is a topic we started discussing last meeting and decided to spend more time today going over it.",1
47,I know @afercia has some comments on this.,1
48,Ah well I can just repeat what I said last week,1
49,"Sorry, I didn’t expect to be pinged",1
50,"my apologies 
 , but if you don’t mind repeating what you said, so we can frame the conversation",1
51,"Basically not much has changed in the way users can navigate back and forth from the content to the sidebar.
If I’m not mistaken, there’s just one more button now that allows to “jump” to the sidebar.
I’d argue this doesn’t address one of the broader issues we, as a team, pointed to since a few months.",1
52,"I’d also like to remind it’s more or less 10 months this team outlines a few, broader, issues in Gutenberg that are mainly related to the general design and layout. 
 No much progress, so far.",1
53,@nrqsnchz Are you willing to help work on visualization and help us make a proposal?,1
54,absolutely!,1
55,OK. Andrea - will you work with me to write up the text & structural changes portion? Then I'll work with Enrique to create design proposals to go with that.,1
56,"speaking of beta, and seeing that there’s little time left, I want to skip to the Status update on 5.4 tickets.",1
57,@audrasjb are you around to give us an update?,1
58,"There is currently 36 tickets in the milestone
- 5 are closed as fixed
- 4 open tickets are tagged for commit",1
59,"Beta 1 is planned for February 11, so next bug scrub (next Monday at 17:00 UTC) will probably be a “punting party”.",1
60,are there any tickets that could move forward with a little push?,1
61,"(it’s a reference for @afercia as we have a FRA-ITA rugby match on Sunday 
 )",1
62,"haha, sounds like it’ll be a fun match",1
63,"Yes, everthing still in the milestone “can” land in 5.4, so feel free to help on them",1
64,"my knowledge of Trac is still very limited, can you share a link with all those tickets, @audrasjb ? (edited)",1
65,https://core.trac.wordpress.org/query?status=accepted&status=assigned&status=new&status=reopened&status=reviewing&keywords=~commit&focuses=~accessibility&milestone=5.4&col=id&col=summary&col=status&col=owner&col=type&col=priority&col=milestone&order=priority,1
66,sure: https://core.trac.wordpress.org/query?status=accepted&status=assigned&status=new&status=reopened&status=reviewing&focuses=~accessibility&milestone=5.4&col=id&col=summary&col=status&col=owner&col=type&col=priority&col=milestone&order=priority,1
67,ah,1
68,I posted the ones ready for commit; so those are two separate lists.,1
69,"ah, got it. Thank you both!",1
70,"Ok, so if anyone has some free time, those tickets from the link @audrasjb just shared could need your help (edited)",1
71,@afercia & @joedolson do you have some time available for commit actions in the next few days?,1
72,"@sergey is always a big help for us too, but he will probably have a lot to do, as 5.4 core tech lead",1
73,Unfortunately I’m a bit short on time. Real life happens. I’d suggest to offer cookies to @sergey for his assistance and help,1
74,"and we’re past the hour, so time to end out meeting </meeting>
Thank you all for joining! Remember the channel is always open, so feel free to stick around. (edited)",1
75,Let’s start the meeting while waiting for joe. <meeting>,1
76,Welcome everyone! Here’s today’s Agenda: https://make.wordpress.org/accessibility/2020/01/30/accessibility-team-meeting-agenda-january-31-2020/,1
77,Let's move on - anybody want to comment on the ticket?,1
78,"If nobody volunteers to comment, I'll take care of it after the meeting.",1
79,I can do it! Sorry - got distracted.,1
80,#48709,1
81,Next up: https://github.com/WordPress/gutenberg/issues/9457,1
82,I'll leave this to @afercia to dive in -,1
83,All right - I'll mention to @nrqsnchz to add this item to next week's agenda.,1
84,Last item!,1
85,Testing the Navigation Block.,1
86,"Finally, Open Floor - anybody have anything to raise?",1
87,let’s get started with out weekly meeting then,1
88,"while everyone joins, here’s today’s agenda: https://make.wordpress.org/accessibility/2020/01/23/accessibility-team-meeting-agenda-january-24-2020/",1
89,let’s get started then,1
90,first item on the agenda is Update on 5.4 trac tickets,1
91,I’d like to start by thanking @audrasjb for organizing and running additional bug scrubs,1
92,the schedule can be found here: https://make.wordpress.org/accessibility/2020/01/19/wordpress-5-4-accessibility-focused-bug-scrubs-agenda/,1
93,Last week we were at 40 accessibility focused tickets still open in the milestone.,1
94,Today we are at 36 open tickets.,1
95,"Reminder: Beta 1 is planned for February 11, 2020. It’s our deadline for committing patches into core.",1
96,Next bug scrub is planned on Tuesday 28th at 17:00 UTC.,1
97,"thanks for the reminders and info @audrasjb!
If you can join a bug scrub, make sure to mark it on you calendars",1
98,let’s move on then,1
99,next item is Update on the last WPAD planning meeting,1
100,last week we had our 3rd (?) planning meeting,1
101,these meetings happen in #accessibility-events,1
102,things are starting to take shape and we already have a few folks volunteering to specific teams,1
103,"and most important, we have a date",1
104,@joedolson I’ll let you share the date with everyone on the team,1
105,"The intended date is September 26th, 2020. That could change, so I wouldn't start promoting it yet, but I don't think a change is very likely. However, planning still has a long way to go!",1
106,"However, with 8 months remaining, and given the current rate of development and participation, I feel that this is a very realistic and plausible timeline.",1
107,"The date was selected to avoid major holidays & WordPress events (releases, camps, etc.), but - obviously - there will still be conflicts that arise. We do what we can!",1
108,"I can add that folks who signed up for website design and development have already a scheduled meeting for next week, so we can start working on that!",1
109,"I’ll move us along then, next on the agenda is Follow up of the Gutenberg block focus project",1
110,let’s move on to the next item: Help testing the navigation block,1
111,the design team is asking for help with testing the navigation block,1
112,We’re almost out of time… does anyone have anything for Open floor?,1
113,"On that note, let’s end the meeting then 
Remember to go to #accessibility-events and vote for the dates that work best for you for next planning meeting.
Also, if you can help with bug scrubs, check out the schedule on https://make.wordpress.org/accessibility/2020/01/19/wordpress-5-4-accessibility-focused-bug-scrubs-agenda/
Hope everyone has a great weekend! 
</meeting>",1
114,"<community-team-chat>
We are kicking off Community Team Chat now. React to this message with your flags so we can see where you’re all from!
For anyone who is joining for the first time (whether active or observing), this is a meeting where community deputies discuss issues that have come up, WordCamps/meetups they are working on, and generally keeping up to date on what is going on in this corner of the WordPress project.
Most contributors on this team are volunteers, but we do have a handful of people who are sponsored to do this work. Ask questions as you have them, but remember we are family-friendly around here.
Reminder: we discuss issues during the chats, but we make decisions on the community blog.
Today’s agenda is here: https://make.wordpress.org/community/2020/02/19/community-team-chat-agenda-20-february-2020/ (edited)",1
115,I am still doing vettings of meetups and happy with the news in the request form for new meetups,1
116,"I’ve done mostly WCEU related stuff, some vetting and HS triage. Also continued mentoring WordCamp Aalborg and Mannheim - both camps are in process of confirming the venue and wrangling budget for review.",1
117,"I’ve been mentoring a few WordCamps, including WC Miami which is happening at the end of this month! Also, ramping up with WCUS, supporting the Diverse Speaker working group, and, of course, vetting applications, doing orientations, and HS triage.",1
118,"Mostly working on WC Asia cancellation things, did mentor check-in with Bengaluru and some regular tasks.",1
119,"I've been working mostly with WC Asia over the past week to assist with cancellation tasks and get things set up for the 2021 event - also the usual keeping things going in HS, etc.",1
120,My time is split between WCEU and Core.,1
121,"Not enough work on other Community issues for me right now, but I’ll try to squeeze in at least one vetting over the weekend (edited)",1
122,"I work for WordCamp Asia. Our organizer team had a mess last week and this week
 But we are learning a lot from it.
I also received Code of Conduct training for WordCamp Asia.
And a regular meeting with Deputy in Japan. We are also consulting with organizers about hosting a Japanese Meetup. About holding, postponement or cancellation depending on the situation at COVID-19.",1
123,"sounds like we are busy with WordCamps, so I guess we can say that the season has started!",1
124,"Even tho the news about cancellation of WC Asia was sad, seeing the response and all the support for organisers from WordPress community made me so happy",1
125,"Okay! Moving forward. We have some P2 posts needing review and feedback. Even commenting +1 or something short to these posts is really valuable and helpful, so please take some time after our team chat to check these posts out.",1
126,"2019 Annual WordPress Meetup Organizer Survey https://make.wordpress.org/community/2020/02/16/2019-annual-wordpress-meetup-organizer-survey/
Annual Meetup Organizer survey has been sent out! If you are a Meetup Organizer, please feel free to share the survey link with your co-organizers. (edited)",1
127,"Worth saying, also survey for meetup members is still open for business https://make.wordpress.org/community/2020/02/04/2019-annual-wordpress-meetup-member-survey/ (edited)",1
128,"I’m busy with WCEU and WCCA stuff, orientations, HS tickets, WC site creations, etc.",1
129,"WordCamp and Meetup application vetting sprints – February 2020 https://make.wordpress.org/community/2020/02/07/wordcamp-and-meetup-application-vetting-sprints-february-2020/
We currently have a backlog of WordCamp and Meetup applications. We would like to request the help of all deputies to help us stay responsive to community members, and to help keep our queues moving forward.
That’s why we are having two more vetting sprints this month: Friday, February 21, 2020, 13:00 UTC and Tuesday, February 25, 2020, 16:00 UTC (edited)",1
130,"Thank you @angelasjin for putting vetting sprints together for this month! Let’s have some again next month, is anyone willing to put sprints together for March?",1
131,maybe someone on Americas friendly meeting will volunteer,1
132,Then we have a bit more highlighted P2 posts this time,1
133,"Applying lessons from agile to event organization: the sprint retro https://make.wordpress.org/community/2020/02/17/applying-lessons-from-agile-to-event-organization-the-sprint-retro/
Jenny Beaumont shared this very interesting post on how WordCamp organizers can improve the way team works. Worth reading! (edited)",1
134,"love that whole post from jenny - its a great format for retrospective for projects and, in our case, wordcamp organising teams",1
135,i would encourage any organising team to run through that after the event - it will really help with identifying things that can be improved for the next one,1
136,Totally! Usually we just throw up an amazing event but forgot to gather feedback properly after it.,1
137,yeah exactly,1
138,"do_action hackathon Cheltenham 2019 – building four websites in a day! https://make.wordpress.org/community/2020/02/13/do_action-hackathon-cheltenham-2019-building-four-websites-in-a-day/
Very nice recap on how do_action hackathon Cheltenham 2019 went! I’m like thiiiiiiiiiiiiis exicted about seeing more and more do_action events takign place 
 (edited)",1
139,Hugh might know; how many do_action events have taken place after launching the event series?,1
140,oh id have to go and check that - its a manual count,1
141,but id say about 40 or so altogether over 3 years,1
142,"Changes in Meetup Organizer Application form https://make.wordpress.org/community/2020/02/19/changes-in-meetup-organizer-application-form/
Some changes were made to the meetup organizer application form and hopefully deputies don’t need to ask more information from applicants so often anymore. (edited)",1
143,"As a side note: I’m also going to review the fields on both WordCamp and Meetup edit view on central.wc.org and see if we can make those simpler. I’ll share the results for discussion on P2 
 There’s also issue for making the original application more easy to read.",1
144,"Community Team Reps for 2020 https://make.wordpress.org/community/2020/02/06/community-team-reps-for-2020-2/
Have you already met our team reps for 2020? If you haven’t take a look on the post and get to know with Mary and Cami. (edited)",1
145,"Last but not least, update from very important working group…",1
146,"Recap of the Diverse Speaker Training group (#wpdiversity) on Feb 12, 2020 https://make.wordpress.org/community/2020/02/13/recap-of-the-diverse-speaker-training-group-wpdiversity-on-feb-12-2020/ (edited)",1
147,"The Diverse Speaker Training working group is awesome! We’ve been working on updating our tools and training, and are working on some EOY reporting.",1
148,"If you’re interested in participating in the working group, we’d love to have you! And, if you’d like to run the workshop in your meetup, we are so ready to help you with that",1
149,"After linking to multiple P2 posts so fast, it’s time for open floor! So for anyone who is here - is there anything youd like to say or talk about?",1
150,"since WC Asia isn't happening, I know a few contributor teams are organising online contributor events in place of the contributor day that would have happened",1
151,"i know of Theme Review, Polyglots and (I think) Marketing",1
152,"we don't have one planned for Community, but if anyone feels like leading a vetting sprint or some other contributor work this weekend, then please do! (and post about it on the p2 
 )",1
153,There’s still time to fire your questions and thoughts on open floor. Anyone have something in their mind?,1
154,Tl;DR the WCEU Contributing Team is aiming to make Contributor Day at WCEU a pivotal point for how Contributor Days are done,1
155,"We would like to get very efficient at onboarding 
 So people don’t only get pumped on the day, but they take the day as the starting point for a long-lasting, sustainable contribution practice",1
156,"In the next few weeks we will ping the Team Reps for each Make team to get comments, ideas, onboarding instructions, tasks, etc…",1
157,We are creating onboarding guides in the WP.org GitHub repo,1
158,"generic for tools that are used by multiple teams
specific for teams",1
159,"These are not duplicated of the Get Started at Contributor day guides that many teams have (and probably need to be reviewed) and they are on GitHub because they are
Team agnostic
Translatable
(edited)",1
160,Thanks for your attention,1
161,"Oh, related to Contributor Day this call from WCEU is also worth mentioning. Spread it to your local communities 
  https://2020.europe.wordcamp.org/2020/02/15/call-for-contributor-stories/ (edited)",1
162,i always love seeing this prep for WCEU come up at this time of year,1
163,we have few minutes left…,1
164,Remember how we discussed about improving the application experience by sending automatic follow-ups to applicants if their application has been waiting for too long?,1
165,Some time ago awesome #meta-wordcamp fixed the confirmation messages and those are now coming to our HS,1
166,…but we still need the automatic follow-ups if that message has been sitting for too long,1
167,"and actually we need also slight change to our process. When we see that message in HS, link to the ticket should be updated to application for further communication",1
168,"mmm, this might need some more thinking actually because we are not currently using the HS API.",1
169,I’m just talking my thoughts out loud here,1
170,"Well, we are near the one hour mark and it means wrapping up this session of community team meeting.",1
171,"Thank you all for being here today! This meeting will be held with same agenda later today at 20:00 UTC for covering americas friendly timezone.
Needless to say, if anyone has questions or feedbacks, do not hesitate to comment, someone will always respond 

</community-team-chat>",1
172,thanks for leading the chat @sippis!,1
173,We are kicking off Community Team Chat now. React to this message with your flags so we can see where you’re all from!,1
174,Today’s agenda is here: https://make.wordpress.org/community/2020/02/19/community-team-chat-agenda-20-february-2020/,1
175,I’m just working on mentoring WordCamp Montclair at the moment. No blockers for me.,1
176,"Working on Youth Working group stuff, and WCUS and mentoring miami’s Kids programming",1
177,"Mentoring WordCamp Charlotte, working on the sponsor team for WC Atlanta, and WCUS .",1
178,"Assisted Meetup organizer via Slack DM., vacation, participated in earlier vetting spring. no blockers apart from “not enough time”",1
179,"mentoring Orlando and San Diego, working with some other camps that need Sponsorship assitance",1
180,"Hello! Diverse Speaker Training group (#wpdiversity):
I have been recording and editing a new Train the Trainers for the last two weeks 
We are working on getting year-end stats for 2019
We are creating new systems for follow-up and tracking how the meetups do with our workshop
We are running monthly train the trainers
etc. ! 
 (edited)",1
181,"I've been working on rolling out the Global Sponsorship program, as well as mentoring Calgary, Little Rock, Tulsa, and Asheville 
 (edited)",1
182,"Loads of WCEU stuff and Core, not enough sleep or hours in the day",1
183,"Orientations and budget reviews, mentoring WordCamps Boston, Chicago, Dallas/Fort Worth, Publishers - Philadelphia, Philadelphia, San Antonio, Santa Clarita, Washington, DC, and the Youth Events working group. Getting my bearings as a team rep, working on getting the Get Involved activation ready for WCEU. And wow y’all have  had a lot of contracts that needed reviewing lately",1
184,"Info on do_action Cheltenham
https://make.wordpress.org/community/2020/02/13/do_action-hackathon-cheltenham-2019-building-four-websites-in-a-day/",1
185,"Diverse Speaker Training Recap
https://make.wordpress.org/community/2020/02/13/recap-of-the-diverse-speaker-training-group-wpdiversity-on-feb-12-2020/",1
186,"One more P2 that is pinned for easy access going forward and certainly great knowledge to have and share with others:
https://make.wordpress.org/community/2019/10/04/how-to-contribute-to-the-global-community-team/",1
187,One thing discussed in earlier version of team meeting was activating WordCamp Central Twitter account. @bph has written excellent proposal about it few years ago and now I'm planning to put up P2 post asking interest to participate on retweeting curated content.,1
188,Just a heads up so that you know that the post is coming,1
189,There’s still time (about 20 minutes) to fire your questions and thoughts on open floor. Anyone have something in their mind?,1
190,"In the next few weeks we will ping the Team Reps for each Make team to get comments, ideas, onboarding instructions, tasks, etc…
We are creating onboarding guides in the WP.org GitHub repo
generic for tools that are used by multiple teams
specific for teams
The basic onboarding guides are not duplicated of the Get Started at Contributor day guides that many teams have (and probably need to be reviewed) and they are on GitHub because they are
Team agnostic
Translatable",1
191,"We will contact Team reps because we would like to prepare tasks, but we welcome feedback from everyone: so if you have any ideas on how to improve Contributor Days so they can be the foundation for long-lasting, sustainable contribution, don’t hesitate to leave comments on the above post (edited)",1
192,"This reminded me about this call for contribution stories from WCEU. Please share it in your local communities and submit your own story 
 https://2020.europe.wordcamp.org/2020/02/15/call-for-contributor-stories/",1
