text,label
This is an interesting read btw by the WCEU team - https://make.wordpress.org/updates/2020/01/27/wceu-2020-leave-no-contributor-behind/#comment-4749,2
we have to tell the world that Docs is not just writing guides,2
have cookies,2
that's always a winner,2
"Joining with core team to ask people to send patches with docs?
badges?
asking people to joining in here?",2
"(and obviously, +1 for cookies)",2
@Kenshino (Jon) did we have any updates on Docs Twitter account?,2
it would come very handy for many things,2
especially promising cookies,2
"I like @felipeelia idea. There are indeed people that rush to the core-php table that would be happy to collaborate with docs patches. But this is a very limited audience though...
Maybe pairing with marketing,  training (there is a table for that, isnt there?) or other tables with non-techincal people...",2
for HelpHub we could pair with polyglots,2
they always have a lot of contributors,2
and then steal a few,2
"I had very fun convos with Polygots, Meta teams on HelpHub at WCEU in 2019",2
we could create a banner One table to rule them all and then explain why Docs are everywhere (edited),2
Hahaha,2
All of these are great - let's keep discussing but we really need to come up with an idea that we can broadcast and share with the WCAsia Contributor Day team so that they can tell attendees,2
Let's get them excited to contribute to Docs,2
"I do think a small refactor in our handbook is very important for the points that @Kenshino (Jon) brought. I remember when he was explaining to me all the Docs ecosystem in WCEU last year, it was very confusing. It shouldn't be confusing.
The more simple it seems to collaborate, the more people will engage...",2
"So if we had at least this ONE page, simple to read and understand, that gives an overview of what we do (and how awesome it is!)",2
Ha. Yeah I knew I was confusing you @leogermani,2
"for example, do we could get stats on page views for devhub and helphub.",2
"People will like the idea of having their hands on something so relevant, and viewed by so many people all over the world",2
Would a review of the new design work for the WCAsia table? I could prepare something,2
"I like the stats idea, very much, as it also allows us to prioritize updates to existing docs when things change in future releases.",2
"It would be important for me, because of the different alphabets and would like to know if it works",2
What is the first step? Random time stamp. 25 days to WordCamp Asia,2
Shall we start a asynchronous private chat?,2
I think Step 1 is to start a Google Doc in our Shared folder,2
We can have a public chat here - no need for a private one. Let's set this survey + our focus at WCAsia as the next meeting focus shall we?,2
I would love for that Survey to be ready to be distributed at WC Asia,2
So we have a month @atachibana,2
"can you please explain what is that survey @Kenshino (Jon) or @atachibana? What questions will it be, target audience, et cetera?",2
"I was hoping we'll build the questions with the general theme being ""How do you think we can improve the WordPress documentation?""",2
Some questions using the likert scale to track how good it is now so we can repeat the survey in the future. Some open fields to get proper feedback so we can define future projects better,2
"Ahh, nice",2
what would we use? Google forms? Airtables?,2
We could definitely work that out,2
We're not limited to choices but let's make sure we can do it again and compare in the future,2
We need to finish our changes ideally before WC Asia,2
When is it?,2
Feb 21,2
looks like a nice goal to me!,2
"how often do we edit our team page? It would be nice if every time we edit that page we assure that badges are ""synced"" with listed folks. Makes sense?",2
"yes, we are planning to do that",2
"looks like on every 6 months, by the way discussion is going",2
"This is something that we could have in our ""Current projects"" page, because is something good for a new contributor to step in.",2
"yes, we have it here: https://make.wordpress.org/docs/handbook/helphub/translating-helphub/
but not in current projects (edited)",2
"I mean, once everything is set up and we hve a clear workflow. But to translate end-user docs is something  good as a first contribution.",2
I think the key thing people are worried about now is keeping an eye of changes on the English docs,2
I hate that it is still manual,2
We could have a contact point between our team and the meta team to get updates on this and speak with them about this issue. What do you think? (edited),2
"there is a channel for this, #meta-helphub",2
there is a meta ticket for that too,2
we can ask there anything we want and that's the right place for that,2
Who can ask there and bring more info on this for the next meeting?,2
Best if we bring in @netweb to talk about this too,2
that's even better,2
"let's not complicate, if @netweb doesn't respond here I'll go there and ask",2
"Question: What are the most important things for each of your locales currently? What are you translating, improving, etc.?",2
for pt_BR I'd say getting more volunteers,2
"in a previous convo here on the channel, @zzap, @nao and @yui talked about it and pointed a few suggestions, including talking about it during meetups, for example.",2
"Yes, more volunteers is always important.",2
What about other locales?,2
"At this moment I am focused on the translation of HelpHub articles into Spanish (Spain, es_ES), not forgetting the maintenance of the rest of the translations (WP, plugins / themes, meta, Apps, etc.), of course",2
Anyone planning for contributor days and/or WordCamps? (edited),2
"Yes, contributor evening end of March in Antwerp.",2
"Not day, but evening, just a few hours.",2
Which is part of day 1 of the WordCamp. (https://2020.antwerp.wordcamp.org/) (edited),2
"Hi, We just plan to translate something in our last meetup, I hope we will complete it by next month.",2
"I think it would be nice to have some projects and tasks for these pledged contributors to pick up, if they are interested in doing anything outside of language translation itself. (e.g. documentation)",2
Yeah. We've got a wishlist of development that would make it easier to contribute translations.,2
This is an attempt to set a common goal as a global team & collection of local teams for 2020.,2
The “Discussion” part has some examples. I was hoping to get some brainstorming going but maybe the focus was not clear?,2
"Maybe I need to set up a form or something instead of a P2 post, so it’s easier for people to give feedback 

@khoipro @nidhijain @lasacco @Sharaz @ronak.ganatra @Afsana (edited)",2
"If you have any current/future goal for your locale team, let me know! (edited)",2
We are planning to setup wordcamp hanoi 2020 at vietnam.,2
Also wish to build a directory of all authors in VN,2
"theme, plugin, services",2
I also think about speaker potiential and want to build that data,2
"About wcasia2020, i hope to see someone from us can handle.",2
"After I wrote that measuring team success post, I wondered if if local teams’ highest focus would be in translation (or should be).
Sounds like vi team has a lot of good plans for community events and encouraging local members to publish themes and plugins on WordPress.org directory. (edited)",2
I think improving the quality is target. (edited),2
Or have any tool for bulk editing wrong string,2
"right now if i found some wrong words from wp core, search and can not find it",2
For that case.,2
Also Helphub translation is target?,2
Sure! HelpHub will be one of 2020 goals for ja,2
So any teams that want to focus on it can too (preferably after completing other major goals like core),2
"It  may be hard to set a generic one-fits-all set of goals for everyone, in fact.",2
Also have any idea to fix suggestion words?,2
"Thinking of yearly goals for various locales, we could probably try to share some examples globally. It'sgood to have goals that are both achievable and inspiring. (edited)",2
"Anyway, @khoipro I think it’d be a good idea to discuss with your team if vi wants forums, and HH will be the team’s goal",2
It’s easy to get started but hard to complete without team effort,2
Sounds like there’s a lot of good plan going for vi team though! That’s great.,2
Can we help with it somehow?,2
Some of the pending requests need gathering of information. But the Spanish ones are pretty straightforward already. It's just some not too big job that needs to be done.,2
I'll make it happen before New Year.,2
"@nobnob, @tokyobiyori, @Jesús Amieiro and I will be in an webinar this Friday. I think this count as mentoring, because each one of us will talk about different topic related with translation, from how to send a translation string to a plugin, to how to use WP Polyglots Facilitator.",2
"If this meeting is interesting for the Spanish community, I think it could be a good idea make it regularly",2
"It would be nice if we could make that part of WP Translation Day somehow, wouldn't it?",2
We can for sure stream the recording next time around.,2
This event was planned last Friday. I was on the translation table on the WordCamp Granada (Spain),2
"I mean, follow the rules of WP Translation Day.",2
"Yup, the event was re-scheduled to this Friday",2
"Actually, before I forget it, @tobifjellner told me the next meeting would happen on Jan. 1st, what can be a difficult day to attend for some of us. Can we postpone it to the week after that?",2
It would happen on Jan 8th,2
I think it's better,2
"Nice, let's postpone it then. I don't know which would be the best way to tell people about it. Perhaps a note on this meeting agenda",2
Or publishing the agenda earlier with the right date makes more sense,2
Sure! I’m looking for feedback for global and local goals for 2020,2
Might be easier for us to think about local ones first (can be very specific to your team),2
"OK next up, there were quite a few discussions at WCUS late last year about a shift of some of the focus for our team. There is a great need for training material with the specific audience of new contributors to the various teams. The scope of this would be different than what we're used to, up to actually creating video content.",2
Thanks for the update Joe!,4
Alright,4
I’m here,4
I’ll revert the PR,4
Do you have any further questions on it?,4
Not really… Any ideas for a better solution?,4
"edit-post-header__settings
edit-post-header__toolbar
 edit-post-header-toolbar__block-toolbar",4
Sorry to jump in. I'm still catching up on the button changes and would love to help if I can.,4
Project management?,4
Instant team meeting agenda from that channel!,4
,4
"I think it's important to set a ""final"" date as soon as possible, so that also WordCamp organizers are aware of the event.",4
"Big thanks to you for organizing and running these planning meetings, @joedolson!",4
"I reviewed your observations in https://docs.google.com/document/d/1QqcbECqUNCBIpzdVdsy1EvplWrJlZ0tte3mRQ0_gLK0/edit#heading=h.cdya1yyxvl8w @joedolson and I did not find anything I disagreed with.
Did anyone else have a chance to review the doc?",4
is there anything we can help you with?,4
"Sorry, I skipped some of the last meetings. Is general or specific feedback needed from the design team?",4
"I mean, do we have already something they would like us to check, or do we have to do a general check? (edited)",4
"nothing specific, they need help with doing a11y testing on the block",4
did that answer your question @ryokuhi?,4
me too!,4
great,4
https://make.wordpress.org/updates/2020/01/27/wceu-2020-leave-no-contributor-behind/,4
"IIRC translating handbooks is not currently possible, but there has been at least some discussions on changing that.",4
pinging @Rocío Valdivia as she was working on that ^,4
and @francina iirc,4
https://make.wordpress.org/community/2020/02/17/applying-lessons-from-agile-to-event-organization-the-sprint-retro/ (edited),4
"2019 Meetup Survey
https://make.wordpress.org/community/2020/02/16/2019-annual-wordpress-meetup-organizer-survey/",4
"HUge Thanks to @angelasjin for putting together this next one:
WordCamp and Meetup Vetting Sprints
https://make.wordpress.org/community/2020/02/07/wordcamp-and-meetup-application-vetting-sprints-february-2020/",4
"This next one is about the form for meetup applicants.
https://make.wordpress.org/community/2020/02/19/changes-in-meetup-organizer-application-form/",4
"And Congrats to @camikaos and @Mary Job for taking on Community Rep that is an amazing role to fill and we are all grateful!
https://make.wordpress.org/community/2020/02/06/community-team-reps-for-2020-2/",4
Hooray!,4
excited to see it,4
"Yes!
https://make.wordpress.org/updates/2020/01/27/wceu-2020-leave-no-contributor-behind/ (edited)",4
Point of clarification.  I’m seeing Youth stuff mentioned to.   Same events different name?  Or are they separate things?,4
"We updated the name to include all minors… that way whether we are talking KidsCamp, or TeenCamp we have an overarching umbrella",4
"re: 1) I forgot, I never heard back from the city official I checked with re: background checks in Ontario.  I’ll follow up again.   Did you ever Christina ever get back to you with any of the info from Alberta?",4
"not yet, but I will put that on the list to follow up with @amethystanswers",4
Ok great.,4
"(Aside, but is there a question about CART services?)",4
Do we have an easy way for people to express interest in this?,4
always,4
@camikaos did I miss anything?,4
I think you got it all.,4
https://trello.com/invite/b/GryYJ7P9/0a44a78f320c0eb04013fa193b0663ce/wordpress-youth-events-working-group,4
Such a great feature!,4
huge thanks to @Courtney P.K. and the working group for getting the global sponsors program for 2020 sorted out (edited),4
and thanks to all the companies sponsoring this year!,4
"We also have Timi sharing in the agenda - what looks like a discussion on a possible proposal P2 for adding status tags to WordCamps eg: looking for sponsor, ticket available, looking for volunteers   https://wordpress.slack.com/archives/C02RQC7RN/p1580905238135800",4
Might be a good idea to write up a post about it for further discussion.,4
And that’s all from me  - how about you? Let’s do a bit of Open Floor discussion before we wrap up. Are there any additional topics that anyone would like to bring up or discuss?,4
i like the idea of statuses for wordcamps like that (edited),4
and we are near the end of the hour!,4
"Promotions of meetups:
I think it'll be a great idea to be involved in promoting new meetup groups. I am thinking social media ads targeting the meetup communities for the first 3 months of the meetup.
Lots of people in the local community don't know about meetups in their communities because the events in some communities are not ""properly"" promoted.
Yes, meetups appear in the dashboard widget but you'll surprised as to the number of people who don't know about the widget. The promotions will also help reach people who are interested in WordPress.",4
one of the things we've been speaking about for some time is a centralised account for running ads for meetups and wordcamps (edited),4
someone has already commented on the plans for 2020 post with the idea to look into that more closely this year,4
it is a great idea and id love to see it happen,4
"its a little bit outside our team's usuall wheelhouse, but we could work with the marketing team on it im sure",4
@Sunday Ukafia The goals post Hugh mentions would  be here https://make.wordpress.org/community/2020/01/15/community-team-goals-for-2020-suggestions-wanted/ - it has a couple of suggestions for paid ads for events (edited),4
"Indeed @Hugh Lashbrooke. I raised this up in #marketing and they mentioned they'll be happy to get involved but that it's not fully within their jurisdiction.
Thanks @Aditya Kane, I'll take a look.",4
yeah - it would be some cross-team colaboration there and we should be looking further into that this year,4
Awesome! @andymci thanks for contributing to WordPress events mentoring,4
4. needs-sharing post!,4
5. Highlighted P2 posts,4
I believe it will be important to make sure WordCamps update their global sponsors if needed.,4
Lots of WC Asia work I see. Super exciting!,4
"And @sippis, thanks for scheduling that vetting sprint. Those seem to be very successful!",4
"Awesome work, everyone, thank you so much for everything you do for this community!",4
"@ricky.blacker anytime there’s something you need help with or want to be sure, just ask here and some fellow deputy online will help with joy",4
Thank you @sippis will do,4
"A scope and requirements doc has been put together for this project, and is shared on that post. It’s open for comments, so if you have feedback, please share!",4
I just copy&pasted your previous post and changed the times,4
"The post also requests feedback, so you can ask questions and make suggestions there",4
So maybe I will resend it this month!,4
they let us know this week only,4
"It’s an important role that helps to facilitate communication among this team, so please do take the time to vote",4
And later this evening for the Americas timezone!,4
Brill!,4
"@estelaris This is related to categorization, but not necessarily the accuracy of the content, correct?",4
Yes I think so - except ideally the audit should quickly name out the outdated pages so that translators can avoid them,4
@tomf It is both (edited),4
We only found 2 inaccurate docs and one that can be killed,4
But we only went as far as 30 articles,4
"there are 170+ articles in total, so it is going to take some time",4
"I think the IA audit can comprise for parallel actions
Content Audit - @tomf 
Information Grouping - @estelaris",4
I expect these two actions to bleed into each other regularly,4
Yes please!,4
Sorry got bit late,4
any questions?,4
"so we ""lost"" 100. is that right?",4
yep,4
"thank you so much 
 where's the script?",4
(Nice job!),4
I have a before and after screenshot saved; will check and post here,4
I have some follow up re. migration but I think i’ll wait until Open Floor,4
ditto,4
I’d love to help automate as much of it as possible,4
we could focus on that at WCAsia CD,4
@bph want to share anything on this topic?,4
@felipeelia didn't check in but has a green ball by the side of his name. So we ping him as well,4
Yes! thanks @zzap,4
(note to self: read last meeting notes before facilitating a meeting),4
"OK, I will follow.",4
ok. So everyone: Last days to share your thoughts on the survey!,4
do we have any focuses @Kenshino (Jon) @atachibana?,4
Oh stats are nice,4
https://docs.google.com/document/d/1-eYk1Xcwo27PLq_tKEcW2Pa7tngrGjLbK05onazfFmw/edit?usp=sharing,4
"yes, please share here",4
mostly related to the Explanation post type setup,4
https://meta.trac.wordpress.org/ticket/5017,4
https://meta.trac.wordpress.org/ticket/5015,4
https://meta.trac.wordpress.org/ticket/5018,4
5018 here I’ve submitted a patch to as well (edited),4
Very nice,4
I’d love some feedback re. 5017 for instance,4
"Yes, it was @netweb",4
"This would be really useful, because we do have a bottleneck right now",4
"Some updates. We had some progress on pt-BR docs. It's not huge, but it's something: 
5 translated pages
1 page in progress
+1 contributor last week
We will have our local docs meeting on Feb 24 and I will inform them about the Documentation badge updates as well.",4
@leogermani not sure what this is about?,4
oh the points at the beginning of the meeting,4
my ticket 5018 tunes in here too…,4
"@themiked I’ve seen you struggle with code formatting over the past few days, right?",4
@leogermani the redirect itself didn’t seem like a big deal; AFAIC it was just a shortcode insertion,4
"yes, it is. But it takes a bit of time. When you are doing many pages at once... anyways",4
(I hid some old tabs),4
"I submitted Jan's badge list last night or today morning. Once that is clear, I assume everyone that should have a badge has it and we can clear up that list properly",4
I think it'll fit our needs (edited),4
"I noticed a duplicate documentation under different categories, is that intentional? Let grab the links",4
https://wordpress.slack.com/archives/C02RP4WU5/p1580739514323000,4
@atachibana is that the code reference for functions?,4
Yes for functions,4
I have to get back working on hooks,4
One more question @atachibana - so that means 447 are fully redirected?,4
"What do you mean fully redirected?
Now, If you go to the Codex page, 1) automatically redirected to Code Reference, or 2) language locator and link exist.",4
Yup I mean sometimes we migrate pages but the examples aren't complete,4
And therefore the redirect isn't put in place,4
I see. Above 447 pages include fully examples.,4
Thank you @atachibana!,4
Let's chat a little deeper next week about that effort,4
he thought it'll take more time,4
Yes I did!,4
yes. it's here https://docs.google.com/document/d/1kZ27_w9crNpZ2gDyi58Mt2JK1gd88u94I4dwK6FR1xg/edit?ts=5e3826a8,4
I can't keep track of all these places,4
@themiked just Make / Docs basically,4
is it intended for en_* only? (edited),4
so this is about documentation of Docs team? It's not (edited),4
added a sentence to asked for volunteers,4
It's HelpHub focused,4
@themiked Yes - the international docs are the canonical source,4
Our presence at WordCamp Asia,4
Please keep chatting async anytime in this channel to talk about how we can garner more interest in WordCamp Asia's Contributor Day,4
"BTW @estelaris posted a first draft of the feedback section on HelpHub pages for people to report issues. https://meta.trac.wordpress.org/ticket/4915#comment:16 Thanks, Estela!!",4
oops sorry @Kenshino (Jon),4
"sorry, I keep posting in between....",4
Yes ^,4
"Workflow docs are being constructed on trello (@zzap is the one to ask for access if needed 
 ). I guess there is not that much of discussion about it.
Badges are being discussed in this P2 post: https://make.wordpress.org/docs/2020/01/08/documentation-team-profile-badges/",4
Regarding helphub any progress for the survey,4
Any progress on multisite docs,4
are we at the question part yet?,4
two questions actually,4
K well maybe I'll just ask,4
@atachibana,4
Sorry just going back to the last topic a little,4
"But, survey's idea was came from @Kenshino (Jon)",4
"Anyway, I don't have any progress. I'll prepare something until the next meeting.",4
@zzap started a very nice convo about getting more volunteers here:,4
https://wordpress.slack.com/archives/C02RP50LK/p1579517985002900,4
https://wordpress.slack.com/archives/C02RP4WU5/p1579535377106800?thread_ts=1579532565.033500&cid=C02RP4WU5,4
atachibana (edited),4
leogermani,4
milana_cap (edited),4
audrasjb (edited),4
marcio-zebedeu (edited),4
wpza (edited),4
kenshino,4
-> nullbyte (edited),4
"Yes, I was going to add something on devhub but did not. I can do this...",4
Ah let's clarify that a little,4
That's lovely,4
"for gutenberg dev handbook, can we have a workflow defined by @pbrocks?",4
That guy is out to lunch,4
and needs to connect with @bph for marching orders,4
"lovely, please do",4
will take discussion out of meeting,4
"Thank you @zzap for creating the topic, all can share their inputs there",4
Thanks for doing that @zzap i keep dropping it from my plate,4
"sure, no problem",4
"I have a question on that matter, if you don't mind",4
we already discussed all that,4
once we have all those things defined we can add those pages to docs team handbook,4
Progress of the survey,4
was this something @bph was working on?,4
"Sorry, I've been away for a while... what survey?",4
Well actually @atachibana,4
Nope... actually I've been a bit away from that too... @felipeloureirosantos has been running this for us (pt-br community),4
We don't have updates there so far as well. There will be in the next weeks.,4
https://meta.trac.wordpress.org/ticket/2082,4
ok ok,4
you it is,4
@atachibana do you own this one?,4
"No 
 Anyone can do it.",4
for sure,4
If so @Pascal might be able to help?,4
Let's do it!,4
@bph had a question for open floor,4
"on the design front for HelpHub, the only update I have is that the design team has requested a number of changes in the mobile version, including the menu. After I present these on Wednesday, I will be able to move forward. The only missing design now, is the page for WP versions",4
"Nice, thanks @estelaris",4
first we made progress on the meta-trac ticket. https://meta.trac.wordpress.org/ticket/4915 feel free to comment,4
Hi @YordanSoares. Any Achievements & Open Floor item to share from your side? (I know you got a lot done last week!),4
Nice collaboration!,4
"So, there are a lot of work to do",4
Sounds really good. I hope many of Spanish variants will get to smoothly release 5.4 at the end of this month.,4
"Any comments, so far?",4
-- (edited),4
Previously we had to wait some 10 hours (give or take),4
"Hope to see you! I’ll post it on P2 soon.
</end>",4
Cool!,4
"example: https://translate.wordpress.org/locale/ru/default/wp-plugins/gutenberg/
we have fully translated Gutenberg plugin, PTE is Otshelnik-Fm",4
No more questions from me,4
"Thanks, @yui for a good explanation",4
Note that en_GB and some other English locales ARE translated versions (as WordPress handles them),4
Yeah. We've hit much higher than we ever could imagine.,4
We are done here.,4
"the /about/stats page is down since a couple of days, probably the root cause of the problem, btw",4
↑ Sounds plausible.,4
The link: https://wordpress.slack.com/archives/C02RP50LK/p1579517985002900,4
That's a big one!,4
Have you translated anything so far in 2020?,4
@felipeelia Are you set for the Americas chat later today?,4
Thanks i ll take a look,4
Ok sure will do that,4
"notably: https://wordpress.org/five-for-the-future/for-individuals/
(update your profile)",4
This is a relatively new piece of functionality.,4
Reference link: https://make.wordpress.org/polyglots/2019/10/17/measuring-polyglots-team-success/,4
:ad,4
:S,4
