text,label
"It's circular design thinking that causes this: struggling to design something that accommodates these controls in context, so let's find some available space for controls, this (desktop) screen is wider than it needs to be for text editing, hey look! There's empty space at the side! Then, of course, we go modal or linearize the content and everything falls apart.",3
"Regardless, what we need to do is decide what we will promote for this. Do we have a agreed-on concept of what we would like this to be? How will it work? Can we mock it up?",3
"I, for one, don't think visually at all; so for me the problem is that I can easily visualize how I want it to work from a screen reader & keyboard standpoint, but then I blank out on visual appearance - because that's not really how I conceptualize interfaces.",3
"I think that we're in general agreement - at least Andrea and I are, from this conversation - that the block settings should be part of the block. They don't all need to be visible all the time; but the code structure should have all block settings within a single context. That's the change I believe that Andrea and I both want to see. (Tell me if you disagree, Andrea.)",3
I don't really give a damn what it looks like.,3
I agree too,3
Joe: you have my vote.,3
how can we materialize this agreement?,3
Suggest / encourage the design team to explore settings within the block and also user-test it?,3
"which is what this team has been doing for months, and we haven’t gotten to where we want. (edited)",3
"how can we move the needle more? I mentioned that perhaps we can suggest solutions. Do y’all think we could try this? I understand not everyone on this team is visual, but some of  us are. We can work together and try?",3
"I don't really know. I feel like the design team keeps coming back to visual design issues; but I think this is a structural issue, first. Fix the structure, then all of the concerns about whether content is being managed in the sidebar go away.",3
We don’t really have a UX team,3
I think that should be a part of the proposal; but it may be stronger combined with a couple of possible visuals.,3
I agree with @ryokuhi: we should encourage the design team to adopt something similar to a progressive enhancement approach,3
@ryokuhi agreed. I think that would be a great step 1.,3
I think we need a three part proposal: text description of the problem; description of the structural changes required to make this happen; and visual proposals showing possible design concepts.,3
"@ryokuhi we can, but many persons in the Design team are more “visual” and I guess they would struggle a bit to get that level of abstraction.",3
and then move to what Joe proposes,3
Structure (required) + Visual (proposal) together may work,3
(I think you've already written a lot of that in GH issues; just need helping find them and assembling them into a proposal...),3
"Maybe after Beta I can try to find some time @joedolson Right now, I’m a bit busy abd very short on time",3
I don't expect this to happen this week!,3
"Timing-wise, I'd think of this as a WP 5.5 targeted concern, which gives us some time.",3
"It's also a major change, so it gives us a lot less time than we might imagine we have...",3
"First item:
Incorrect cursor used on buttons: this Trac ticket needs a decision from the accessibility team.
https://core.trac.wordpress.org/ticket/47171",3
"This is one of those things that's incorrect all over the internet, and probably comes from the general conflation of button and link behavior. I think it's a good idea for us to try to be consistent, although it will probably be offputting and confusing for some users, at first.",3
"In a nutshell: The native browsers cursor on buttons and labels is the default one.
WordPress overrides the browsers default by using the pointer cursor which, ideally, should be reserved for links.",3
I vote for default cursor on buttons and save pointer for links.,3
"So is this just in the WP admin, or applies to the button block also?",3
In which case we also need to have some clarity between behaviors & elements. Should an anchor element that performs a button function have the default cursor?,3
"@joyously Confusingly, I believe the button block is most often used to insert a link that looks like a button",3
"The button block outputs a link, an <a>  element where the pointer cursor is appropriate.",3
"Also, the cursor style for the button block should be controlled by the theme.",3
"Regardless, we have to address several cases: button elements that operate as buttons, button elements that operate as links, anchors that operate as buttons, and anchors that operate as links. The first and last are unambiguous; but the other two cases we'll have to make decisions about.",3
Maybe the solution to those cases is to use the correct elements for their purpose,3
"Ideally, change the buttons that are actually links to be just links?",3
"The WP Campus report specifically says that the ""controls that navigate users to new pages/views should have cursor set to pointer"", so if we follow those guidelines, then it's the behavior that's dominant for this.",3
"This is one of those things that’s incorrect all over the internet,
Playing devil’s advocate: Does it actually harm the users experience? (edited)",3
"This is one of those ""maybe"" cases - it is possible that it could confuse a user. However, it's conflated so significantly globally, that I'd argue it could also confuse a user for a button not to have the pointer cursor. It's just that one of those cases is correct and the other is not.",3
Not all links are blue and underlined either.,3
"There’s no requirement that links be blue, but they should be underlined.",3
"On the whole, I don't think this is a super important issue; I'd prioritize ensuring that elements are used appropriately, first. But it's also a pretty easy fix, once we decide exactly what should change.",3
"Let's try to stay focused on the issue, thanks!",3
"Question (as always, I ask questions): would changing the pointers so that they match their suggested usage be detrimental for someone?",3
"I think that the consequence might be some small hesitation because a user expected a pointer cursor, and momentarily hesitated before taking their action. That's probably about it.",3
Test page: https://codepen.io/afercia/full/EzjXMo,3
"I think we should make the change. The only reason the pointer cursor would normally be necessary is if we're in a situation where the button has no discernible :hover state, as in that case the pointer cursor is the only visual indicator that the button is an active element.",3
"Apart from pointer changes, are there other ways to suggest to the user that the element allows interaction (for example: changing hover background color)?",3
All kinds of style changes can be made on focus/hover to communicate affordance. (edited),3
"As per specs reference, it’s stated in the CSS specs:
The W3C spec (CSS 2.2) https://www.w3.org/TR/CSS22/ui.html#cursor-props
pointer: The cursor is a pointer that indicates a link.
Same for CSS3 UI: https://www.w3.org/TR/css-ui-3/#cursor
The rationale is that pointer should be reserved for links, to help users differentiate UI controls that trigger navigation from buttons and the like. Granted, in WordPress you never know whether what are you going to click is a button or a link For historical reasons, sometimes links are styled as buttons, and buttons are styled as links. Ideally, this shouldn't happen. Links should be clearly identified as links. Buttons should be identified as buttons.
(edited)",3
"If we agree, then we have to decide whether we're going to just change all button elements, period, or only change button elements if they don't move the user to a new location or change the view.",3
"Just buttons that actually behave like buttons, I think.",3
"A button is a button, and an anchor is an anchor: I would go with the standard.",3
"The question is whether we're going to take the remediation advice in the WP Campus issue or choose a different solution, essentially.",3
"Well, I think revisiting where buttons/links are used is another issue that should be addressed.",3
"I'm inclined to switch all button elements to use the default pointer, then, as @nataliemac suggests, address any problematic buttons as a separate issue.",3
There's an issue for that already in trac from the last time we looked at those.,3
"Ok, I can get on board with that approach.",3
"I’d tend to think our recommendation as accessibility team should be to just stick to the standards.
That said, I guess we should get some consensus from design and I’m not sure this can be done for 5.4.",3
"If design agrees, this is a pretty simple CSS change - I think it should be doable.",3
"Yep, my concern is about getting consensus in time",3
"I'd also go for the standard: but I would remove cursor properties, instead of changing them to default (if that might be equally good). (edited)",3
"Well, let's go for it. If it doesn't make it, that's fine; but I don't see any reason not to go for it.",3
I think the result is likely the same,3
Less code = more speed.,3
"Per comments on the thread, by the way, the last call from design was ""it's accessibility's call""",3
"I’d add that if there’s really a usability issue with buttons and labels, it would be up to browser vendors and the W3C to fix it.",3
Shortly: don’t mess with browser defaults.,3
I would be perfectly happy if browsers decided to abruptly change the button default cursor to something else; I don't think we need to make that happen.,3
Amen.,3
"It's accessibility call, but the design team suggestions were different from ours, I would ping them just for information.",3
"Not sure I agree; looks disabled to me. I'm fine leaving this to design to address, though.",3
"Just noting WP buttons worked this way since forever. That’s not to say they can’t be improved. Nothing new, though.",3
Maybe someone would expect it to be gray if it’s disabled? I think it looks disabled the way it is as well.,3
"I'm fine commenting for accessibility that we don't have any issues with making design changes to the disabled button look, but that we don't see an accessibility problem here.",3
"Considering that disabled controls don’t have contrast requirements, I’d say it’s a design team call.",3
"For discussion today, we can ignore my last comment on that issue. Even if that method is not only possible but better, it's not going to be ready within 2 weeks.",3
My point on this issue is that this team official position is to avoid placing controls in the Gutenberg sidebar as much as possible.,3
That comment ties in with something we've wanted for a long time - the ability to have a relationship between videos and their caption files...,3
This was a concern since the very early accessibility reviews of Gutenbreg and also highlighted in this team Make post on end 2018l,3
"Now, in the current media views interface, the main source file and the alternate sources are displayed all together in the same UI.",3
The proposal on the issue is to place the alternate sources in the sidebar.,3
So the change would be from a unified UI to a split one.,3
I’m not sure this is an accessibility improvement,3
"Is there a mockup of what's currently proposed? I assume it's not @mapk's comment from 27 Dec., but that's the last one I'm seeing.",3
"Most of all: the official position of this team is that the Gutenberg sidebar is one of the broader, still in-need-to-be-solved, issues in Gutenberg.",3
"In all tests I made with users at the Accessibility table during WordCamps, moving for the editor to the sidebar using only the keyboard is very complicated, even for sighted users. I wouldn't add anything there. (edited)",3
"I think that this issue is not what we're discussing - it's just the general question of whether we still hold to our stance that the Gutenberg sidebar is an unsolved issue such that we need to avoid adding controls to it. Is that accurate, @afercia?",3
"Yup, this specific issue is obviously depending on our stance on the sidebar.",3
"To my knowledge, the only change is that there’s now one more button to “jump” to the sidebar.",3
"OK. I think that we should probably give more time to that discussion, practically speaking. I'd need to refresh my memory on how the sidebar works now.",3
Are you OK with tabling this question to have a more broad-ranging conversation next week?,3
"Probably; but mostly I need to work on converting these notes into something that could be reasonably posted as GitHub issues. Anybody have an opinion whether I should post a unique issue for each block, an issue for each type of issue described, or one single issue listing everything?",3
(I feel like that last option is not a good one...),3
"If we create a unique issue for each block, I think that the general framework of the proposed changes might be less clear.",3
"Question - who would be the audience for the GitHub issues? If it is those who will need to make changes, an issue for each block would seem to make more sense?",3
"That was also my concern.  Easier to resolve, however, possibly.",3
"Maybe one issue per issue, and then whoever gets to work on it will decide if they split it into multiple sub issues or not? (edited)",3
"It's also possible that these issues would be best resolved as a group, anyway; a single common change through several blocks might be best done as a single commit.",3
I'll go with that. One issue for each type of concern.,3
"Maybe these issues can be grouped in a single project: this way, it would be easier to understand them as a whole. (edited)",3
"I wonder if we can do something coordinated, like what Joe did for the block focus.
Does anyone have any thoughts?",3
Somebody who isn't me should definitely coordinate that.,3
totally agree,3
"I’m happy to coordinate things, just want to hear what folks think",3
"It's a very different type of project - the issue logging will be more complicated than block focus was, since it's not a single pattern we're checking behavior of.",3
"I think the point of doing logging outside of GitHub is so that we can take a look at our concerns as a group; log all the issues that we see, discuss them and agree on them, then transition into GitHub issues - it's a good way to form an overview of concerns & reaching agreement before we create issues. That said, a lot of what we need here is a means to log and track a variety of related but disparate issues.",3
So we need to figure out a good method to do that - that isn't directly in the Gutenberg GitHub repo. I'm not sure we need to be overly formal about it - maybe a combination of Google Docs & Sheets is sufficient. Thoughts?,3
"yep, I agree with what you said. We can use google docs for our initial testing and observations and then move whatever we think needs to be moved to github issues",3
Thoughts on offering it prior to WC Atlanta (April 17th) or after? (edited),3
"Hmm, it could easily be a series that spans before and after",3
"I think that if you do it before, it could help get some new fresh topics/events on the schedule. So once the WordCamp is over, you'll probably have a lot more interested new meetup members, and events already planned to keep the momentum going",3
"and if you keep up with it, new organizers for the next WordCamp too!",3
Excellent suggestions! I will get something scheduled in March to kick it off.,3
Would we want these to be the same or different mentors than the amazing ones who do the main camps?,3
Different.,3
"Mentors need to have first hand experience of what they’re mentoring on. Most WordCamp organizers, myself included, haven’t organized a KidsCamp.",3
We could change that @camikaos,3
"Hello, sorry I was not able to get out of another WP meeting in time to ask this in your chat today. A question from the marketing team. 
Is there any further promotion planned we can help you with or link to for the Meetup survey. Mike Reid highlighted it to the marketing team at this week’s meeting as he received it as a Meetup organizer. Good luck with the survey, and do let us know if we can help.
https://wordpressdotorg.survey.fm/2019-annual-meetup-program-survey",3
"There have been a few discussions to date around how we can improve annual surveys, and we’ve come to some conclusions, shared on that post. Please take some time to review and weigh in!",3
"great proposal, would really love to see those happen. Hopefully the changes will increase amount of persons responding.",3
yeah - the number of responses there have been diminshing each year,3
"Agreed, it would be fantastic and super helpful to get more response on that survey!",3
The next post is a request for feedback on Speaker Feedback Tool Scope: https://make.wordpress.org/community/2020/01/14/feedback-request-speaker-feedback-tool-scope/,3
"The first is a Proposal for an official WordCamp app for iOS, watchOS and tvOS. You can find more info on that here: https://make.wordpress.org/community/2020/01/10/proposal-for-an-official-wordcamp-app-for-ios-watchos-and-tvos/",3
"to be honest, not sure if we need an official app. That will needs someone actively to maintain it…",3
"Maintenance is a very good question, and I think the proposal suggests that the Mobile team do that",3
"I think the features are very limited - just offering whats available in central website.
Platform is biased for iOS users only",3
"im not sold on the idea in general, regardless of how good the app is",3
i dont know if an app is really something that we need or something that would be particularly useful,3
"As we found out, our handbook needs to be updated. We already started working on the worflows for ""everything"" we do, so we can better document it and people can easily find out how to collaborate",3
"I gave it a look on how people navigate through our handbook and saw that our ""Welcome box"" is really outdated and have consufing links...",3
"I started a proposal to change that, and also create a home page for our handbook, that has an short overview of what we do and then will link to more detailed pages for each project",3
"Regarding the welcome box, The initial phrase is tricky. It used to say that we were responsible for everything related to Docs, but we now share it with other teams... I made a suggestion on how to write that, but definetely needs some attention",3
"and also the Home page... I tried to propose something really simple, that gives an overview. I tried to think of something that would have helped me when I first came to the team",3
"(about this, for example, I introduce the DevHub and HelpHub names, because this is something we use internally, but that do not show up anywhere in the interface for visitors... so its very confusing - then I favored using developer.wordpress.org and wordpress.org/support instead",3
"So for now, just wanted to ask for feedback/help on those contents",3
I can take a look at that this week @leogermani,3
"But also, everyone should",3
This is just an addition to Sunday's comments earlier,3
"When we migrated content, we had a lot of volunteers, I noticed references to some supporting WordPress.com help docs that shouldn't have been there",3
"And something came up last week about external links and the policy...and although they don't really violate the policy, some of them probably are outdated",3
"Point is, some of that content probably still needs to be revisited for updates and such",3
@leogermani Create a meta ticket and Ill chime in there,3
@tomf Do you have a list of those pages that contain outdated / irrelevant WordPress.com links?,3
"@Kenshino (Jon) Not really, but I noticed in the process, we weren't so much focused on accuracy of the content at that point, but just getting it moved",3
"Yes, the problems I've seen out on the net elsewhere being reported I don't think are necessarily related to accuracy per say, but reactive",3
"Yet, we did manage to classify many and some people committed to continue helping until we are done",3
"I think our comments were not reactive, but more on the ""how do we help update that article?"" kind of way",3
Do we have the notes of your discussion somewhere? ^,3
"@estelaris With these updates being made, is it worth continuing with the help happy translations? (edited)",3
@Kenshino (Jon) what about the documents that need a better title? Should I give a list of those to @tomf?,3
"I have it hidden in the shadows 
 shall I throw it onto GitHub or something?",3
please do,3
noted,3
"yes, please share it.",3
We definelty need some action to speed this migration up and finish it,3
"with that out of hte way, this survey seems to be asking some questions we can find out without theuser tellingus",3
"for example, how they found us. Thats just stats analysis",3
"Is the goal for the survey from a user view (using the product and finding documentation) or developer view (creating plugins, extending) or both?",3
what device they use...same,3
"the question being asked is ""How complete is our documentation and how can we improve our user docs?""",3
@themiked agree. We talked about looking at stats last week.,3
yep I remember,3
"""How complete is our documentation"" is not an answerable question",3
esp not for end users,3
"I guess we should leave this feedback in the p2 post, so it's all in one place. I'd love to hear from @bph what is a good road map for the survey, with WC Asia in mind.
Feedback period - date
First draft of the form - date
Feedback on the form - date
Release date- date",3
"Also, if anyone is willing to help her on that, please raise your hands in the p2 post. It's a lot of work",3
I think we already set deadline because she's going to holiday soon (edited),3
"Please add your comments by February 12th, and we will be able to prepare the survey in time for launch at WordCamp Asia, February 21st.",3
"@themiked asking in an open ended form like that won't get the answer we want, but it is answerable. If a user is trying to do something, are they getting the answer from WP or elsewhere? (edited)",3
"Who can answer whether we have access to CrowdSignal? If not, iss Google forms an option?",3
why CrowdSignal? was it decided on previous meetings?,3
"CrowdSignal is former Pollbuddy... no decision, but it's the one that might stick around and is not on rented land...",3
as it's owned by Automattic.,3
"oki doki, I think we'll have more info from @Kenshino (Jon)",3
"Does someone want to review whether CrowdSignal is appropriate?
ATM I have pretty low requirements. True false, 5 point likert scale + open ended questions",3
I can create account and test it,3
"yes, it's problematic because HelpHub is child theme for bbPress, plus we want to have SVN and GIT in the same repo",3
"@valentinbora regarding the automation of the redirect process, we have discussed it before and there is an understanding that we didnt want to make it in batch, because we wanted to have our eyes on it. Not sure if it will change one day",3
yes I am very well aware that it’s all handmade work,3
but if there are any opportunities to automate small parts of it count me in,3
I think @atachibana had a little tool to convert Wiki style formatting to the new style too,3
https://unofficialtokyo.com/codex-converter/,3
random stumble upon,3
We should also maybe put out a bit of a celebratory post when we get over 50%,3
Afterall this migration has been going on for like... 5 years,3
(It was stuck until you took it over),3
Okay so the thing is about that and I'm so sorry for holding on to the info for so long,3
"@chanthaboune would like us to actually verify that we had higher engagement when the main WordPress twitter account pushed things out than now where it doesn't.
The assumption that having a Twitter account is just going to magically increase engagement isn't necessarily true, and it may create a discussion channel (on Twitter) that doesn't migrate back to Slack or P2",3
I don't even know if main WordPress account publish things that are specific to what's currently happening in docs team,3
(I didn't even know we have a Twitter account for docs),3
"never mind, we can publish p2 post about what we want to do at WC Asia and then share it everywhere",3
We don't have a Twitter account for Docs,3
The general direction is that the main WordPress account used to publish important news across teams. Now it doesn't.,3
That's what I meant,3
Engagement didn't seem to suffer,3
^ That's the general opinion at the top,3
I don't think it was as detailed as team members would be,3
personally I see a lot of potential but that's probably another discussion for another time,3
one question about those,3
"if someone is translating HelpHub, which badge do they get?",3
polyglots is automatic from glotpress,3
so people will not get one for translating HH,3
"Docs Team. Cause it's not just translation, they're gonna have to learn how to write good docs in their language",3
oki doki,3
They essentially become the localised Docs Team,3
similar question: if someone creates a PR for github gutenberg docs. they get a core badge,3
should they also get a documentation badge?,3
"If they already get a Core Badge, we won't double it up",3
"hm, if someone creates a patch improving the docs for a function, shouldn't he/she receive a docs badge too? (about doubling it up)",3
they automatically get core badge,3
"yep, I know, but shouldn't they receive a docs contrib one?",3
They are improving in-line docs for Core,3
"only if they do things with examples, I guess",3
We've almost gotten to the point that we no longer handle in-line docs.,3
In the similar way we no longer handle handbook changes for other teams,3
(We used to),3
"makes sense, thanks",3
"and about localized HelpHubs, that will require some locale reps, right?",3
